A1: Galaxie 500 Mailing List // Survey Results // 1995 - 2002
A2: Damon & Naomi album | B2: 35034 | D2: 35217 | F2: 35400 | H2: 35582 | J2: 35947 | L2: 36312 | N2: 36708 | P2: 37591
A3: More Sad Hits | B3: 18 | C3: =B3/SUM(B3:B6) -> 0.8571428571428571 | D3: 7 | E3: =D3/SUM(D3:D6) -> 0.46666666666666667 | F3: 17 | G3: =F3/SUM(F3:F6) -> 0.62962962962962965 | H3: 18 | I3: =H3/SUM(H3:H6) -> 0.72 | J3: 25 | K3: =J3/SUM(J3:J6) -> 0.67567567567567566 | L3: 24 | M3: =L3/SUM(L3:L6) -> 0.68571428571428572 | N3: 20 | O3: =N3/SUM(N3:N6) -> 0.60606060606060608 | P3: 16 | Q3: =P3/SUM(P3:P6) -> 0.48484848484848486
A4: Wondrous World… | B4: 3 | C4: =B4/SUM(B3:B6) -> 0.14285714285714285 | D4: 8 | E4: =D4/SUM(D3:D6) -> 0.53333333333333333 | F4: 10 | G4: =F4/SUM(F3:F6) -> 0.37037037037037035 | H4: 7 | I4: =H4/SUM(H3:H6) -> 0.28 | J4: 7 | K4: =J4/SUM(J3:J6) -> 0.1891891891891892 | L4: 5 | M4: =L4/SUM(L3:L6) -> 0.14285714285714285 | N4: 5 | O4: =N4/SUM(N3:N6) -> 0.15151515151515152 | P4: 3 | Q4: =P4/SUM(P3:P6) -> 9.0909090909090912E-2
A5: Playback Singers | C5: =B5/SUM(B3:B6) -> 0 | E5: =D5/SUM(D3:D6) -> 0 | G5: =F5/SUM(F3:F6) -> 0 | I5: =H5/SUM(H3:H6) -> 0 | J5: 5 | K5: =J5/SUM(J3:J6) -> 0.13513513513513514 | L5: 6 | M5: =L5/SUM(L3:L6) -> 0.17142857142857143 | N5: 8 | O5: =N5/SUM(N3:N6) -> 0.24242424242424243 | P5: 5 | Q5: =P5/SUM(P3:P6) -> 0.15151515151515152
A6: With Ghost | C6: =B6/SUM(B3:B6) -> 0 | E6: =D6/SUM(D3:D6) -> 0 | G6: =F6/SUM(F3:F6) -> 0 | I6: =H6/SUM(H3:H6) -> 0 | K6: =J6/SUM(J3:J6) -> 0 | M6: =L6/SUM(L3:L6) -> 0 | O6: =N6/SUM(N3:N6) -> 0 | P6: 9 | Q6: =P6/SUM(P3:P6) -> 0.27272727272727271
A8: Damon & Naomi song | B8: 35034 | D8: 35217 | F8: 35400 | H8: 35582 | J8: 35947 | L8: 36312 | N8: 36708 | P8: 37591
A9: This Car Climbed Mt Washington | B9: 6 | C9: =B9/SUM(B9:B46) -> 0.375 | D9: 2 | E9: =D9/SUM(D9:D46) -> 0.33333333333333331 | F9: 9 | G9: =F9/SUM(F9:F46) -> 0.15517241379310345 | H9: 10 | I9: =H9/SUM(H9:H46) -> 0.35714285714285715 | J9: 14 | K9: =J9/SUM(J9:J46) -> 0.18421052631578946 | L9: 16 | M9: =L9/SUM(L9:L46) -> 0.23529411764705882 | N9: 20 | O9: =N9/SUM(N9:N46) -> 0.22222222222222221 | P9: 9 | Q9: =P9/SUM(P9:P46) -> 0.14516129032258066
A10: ETA | B10: 5 | C10: =B10/SUM(B9:B46) -> 0.3125 | D10: 2 | E10: =D10/SUM(D9:D46) -> 0.33333333333333331 | F10: 8 | G10: =F10/SUM(F9:F46) -> 0.13793103448275862 | H10: 6 | I10: =H10/SUM(H9:H46) -> 0.21428571428571427 | J10: 7 | K10: =J10/SUM(J9:J46) -> 9.2105263157894732E-2 | L10: 6 | M10: =L10/SUM(L9:L46) -> 8.8235294117647065E-2 | N10: 11 | O10: =N10/SUM(N9:N46) -> 0.12222222222222222 | P10: 7 | Q10: =P10/SUM(P9:P46) -> 0.11290322580645161
A11: Information Age | C11: =B11/SUM(B9:B46) -> 0 | E11: =D11/SUM(D9:D46) -> 0 | F11: 3 | G11: =F11/SUM(F9:F46) -> 5.1724137931034482E-2 | H11: 4 | I11: =H11/SUM(H9:H46) -> 0.14285714285714285 | J11: 10 | K11: =J11/SUM(J9:J46) -> 0.13157894736842105 | L11: 10 | M11: =L11/SUM(L9:L46) -> 0.14705882352941177 | N11: 8 | O11: =N11/SUM(N9:N46) -> 8.8888888888888892E-2 | P11: 5 | Q11: =P11/SUM(P9:P46) -> 8.0645161290322578E-2
A12: New York City | C12: =B12/SUM(B9:B46) -> 0 | E12: =D12/SUM(D9:D46) -> 0 | F12: 4 | G12: =F12/SUM(F9:F46) -> 6.8965517241379309E-2 | I12: =H12/SUM(H9:H46) -> 0 | J12: 4 | K12: =J12/SUM(J9:J46) -> 5.2631578947368418E-2 | L12: 3 | M12: =L12/SUM(L9:L46) -> 4.4117647058823532E-2 | N12: 5 | O12: =N12/SUM(N9:N46) -> 5.5555555555555552E-2 | P12: 4 | Q12: =P12/SUM(P9:P46) -> 6.4516129032258063E-2
A13: Judah and the Macabees | C13: =B13/SUM(B9:B46) -> 0 | E13: =D13/SUM(D9:D46) -> 0 | G13: =F13/SUM(F9:F46) -> 0 | I13: =H13/SUM(H9:H46) -> 0 | K13: =J13/SUM(J9:J46) -> 0 | M13: =L13/SUM(L9:L46) -> 0 | O13: =N13/SUM(N9:N46) -> 0 | P13: 4 | Q13: =P13/SUM(P9:P46) -> 6.4516129032258063E-2
A14: Turn of the Century | C14: =B14/SUM(B9:B46) -> 0 | E14: =D14/SUM(D9:D46) -> 0 | G14: =F14/SUM(F9:F46) -> 0 | I14: =H14/SUM(H9:H46) -> 0 | J14: 7 | K14: =J14/SUM(J9:J46) -> 9.2105263157894732E-2 | L14: 7 | M14: =L14/SUM(L9:L46) -> 0.10294117647058823 | N14: 9 | O14: =N14/SUM(N9:N46) -> 0.1 | P14: 3 | Q14: =P14/SUM(P9:P46) -> 4.8387096774193547E-2
A15: Eye Of The Storm | C15: =B15/SUM(B9:B46) -> 0 | E15: =D15/SUM(D9:D46) -> 0 | G15: =F15/SUM(F9:F46) -> 0 | I15: =H15/SUM(H9:H46) -> 0 | K15: =J15/SUM(J9:J46) -> 0 | L15: 4 | M15: =L15/SUM(L9:L46) -> 5.8823529411764705E-2 | N15: 4 | O15: =N15/SUM(N9:N46) -> 4.4444444444444446E-2 | P15: 3 | Q15: =P15/SUM(P9:P46) -> 4.8387096774193547E-2
A16: The Navigator | C16: =B16/SUM(B9:B46) -> 0 | E16: =D16/SUM(D9:D46) -> 0 | G16: =F16/SUM(F9:F46) -> 0 | I16: =H16/SUM(H9:H46) -> 0 | J16: 5 | K16: =J16/SUM(J9:J46) -> 6.5789473684210523E-2 | L16: 5 | M16: =L16/SUM(L9:L46) -> 7.3529411764705885E-2 | N16: 7 | O16: =N16/SUM(N9:N46) -> 7.7777777777777779E-2 | P16: 2 | Q16: =P16/SUM(P9:P46) -> 3.2258064516129031E-2
A17: Laika | B17: 5 | C17: =B17/SUM(B9:B46) -> 0.3125 | D17: 2 | E17: =D17/SUM(D9:D46) -> 0.33333333333333331 | F17: 5 | G17: =F17/SUM(F9:F46) -> 8.6206896551724144E-2 | H17: 2 | I17: =H17/SUM(H9:H46) -> 7.1428571428571425E-2 | J17: 9 | K17: =J17/SUM(J9:J46) -> 0.11842105263157894 | L17: 4 | M17: =L17/SUM(L9:L46) -> 5.8823529411764705E-2 | N17: 6 | O17: =N17/SUM(N9:N46) -> 6.6666666666666666E-2 | P17: 2 | Q17: =P17/SUM(P9:P46) -> 3.2258064516129031E-2
A18: Tour Of The World | C18: =B18/SUM(B9:B46) -> 0 | E18: =D18/SUM(D9:D46) -> 0 | F18: 2 | G18: =F18/SUM(F9:F46) -> 3.4482758620689655E-2 | H18: 6 | I18: =H18/SUM(H9:H46) -> 0.21428571428571427 | J18: 6 | K18: =J18/SUM(J9:J46) -> 7.8947368421052627E-2 | L18: 5 | M18: =L18/SUM(L9:L46) -> 7.3529411764705885E-2 | N18: 3 | O18: =N18/SUM(N9:N46) -> 3.3333333333333333E-2 | P18: 2 | Q18: =P18/SUM(P9:P46) -> 3.2258064516129031E-2
A19: Blue Moon | C19: =B19/SUM(B9:B46) -> 0 | E19: =D19/SUM(D9:D46) -> 0 | G19: =F19/SUM(F9:F46) -> 0 | I19: =H19/SUM(H9:H46) -> 0 | K19: =J19/SUM(J9:J46) -> 0 | M19: =L19/SUM(L9:L46) -> 0 | O19: =N19/SUM(N9:N46) -> 0 | P19: 2 | Q19: =P19/SUM(P9:P46) -> 3.2258064516129031E-2
A20: I Dreamed of the Caucasus | C20: =B20/SUM(B9:B46) -> 0 | E20: =D20/SUM(D9:D46) -> 0 | G20: =F20/SUM(F9:F46) -> 0 | I20: =H20/SUM(H9:H46) -> 0 | K20: =J20/SUM(J9:J46) -> 0 | M20: =L20/SUM(L9:L46) -> 0 | O20: =N20/SUM(N9:N46) -> 0 | P20: 2 | Q20: =P20/SUM(P9:P46) -> 3.2258064516129031E-2
A21: Song to the Siren | C21: =B21/SUM(B9:B46) -> 0 | E21: =D21/SUM(D9:D46) -> 0 | G21: =F21/SUM(F9:F46) -> 0 | I21: =H21/SUM(H9:H46) -> 0 | K21: =J21/SUM(J9:J46) -> 0 | M21: =L21/SUM(L9:L46) -> 0 | O21: =N21/SUM(N9:N46) -> 0 | P21: 2 | Q21: =P21/SUM(P9:P46) -> 3.2258064516129031E-2
A22: Tanka | C22: =B22/SUM(B9:B46) -> 0 | E22: =D22/SUM(D9:D46) -> 0 | G22: =F22/SUM(F9:F46) -> 0 | I22: =H22/SUM(H9:H46) -> 0 | K22: =J22/SUM(J9:J46) -> 0 | M22: =L22/SUM(L9:L46) -> 0 | O22: =N22/SUM(N9:N46) -> 0 | P22: 2 | Q22: =P22/SUM(P9:P46) -> 3.2258064516129031E-2
A23: 1969 | C23: =B23/SUM(B9:B46) -> 0 | E23: =D23/SUM(D9:D46) -> 0 | G23: =F23/SUM(F9:F46) -> 0 | I23: =H23/SUM(H9:H46) -> 0 | K23: =J23/SUM(J9:J46) -> 0 | M23: =L23/SUM(L9:L46) -> 0 | N23: 1 | O23: =N23/SUM(N9:N46) -> 1.1111111111111112E-2 | P23: 1 | Q23: =P23/SUM(P9:P46) -> 1.6129032258064516E-2
A24: Boston's Daily Temperature | C24: =B24/SUM(B9:B46) -> 0 | E24: =D24/SUM(D9:D46) -> 0 | F24: 2 | G24: =F24/SUM(F9:F46) -> 3.4482758620689655E-2 | I24: =H24/SUM(H9:H46) -> 0 | K24: =J24/SUM(J9:J46) -> 0 | M24: =L24/SUM(L9:L46) -> 0 | N24: 1 | O24: =N24/SUM(N9:N46) -> 1.1111111111111112E-2 | P24: 1 | Q24: =P24/SUM(P9:P46) -> 1.6129032258064516E-2
A25: Forgot to Get High | C25: =B25/SUM(B9:B46) -> 0 | E25: =D25/SUM(D9:D46) -> 0 | F25: 2 | G25: =F25/SUM(F9:F46) -> 3.4482758620689655E-2 | I25: =H25/SUM(H9:H46) -> 0 | K25: =J25/SUM(J9:J46) -> 0 | M25: =L25/SUM(L9:L46) -> 0 | N25: 1 | O25: =N25/SUM(N9:N46) -> 1.1111111111111112E-2 | P25: 1 | Q25: =P25/SUM(P9:P46) -> 1.6129032258064516E-2
A26: Little Red Record Co. | C26: =B26/SUM(B9:B46) -> 0 | E26: =D26/SUM(D9:D46) -> 0 | F26: 3 | G26: =F26/SUM(F9:F46) -> 5.1724137931034482E-2 | I26: =H26/SUM(H9:H46) -> 0 | J26: 3 | K26: =J26/SUM(J9:J46) -> 3.9473684210526314E-2 | M26: =L26/SUM(L9:L46) -> 0 | N26: 1 | O26: =N26/SUM(N9:N46) -> 1.1111111111111112E-2 | P26: 1 | Q26: =P26/SUM(P9:P46) -> 1.6129032258064516E-2
A27: Pyewacket | C27: =B27/SUM(B9:B46) -> 0 | E27: =D27/SUM(D9:D46) -> 0 | F27: 2 | G27: =F27/SUM(F9:F46) -> 3.4482758620689655E-2 | I27: =H27/SUM(H9:H46) -> 0 | K27: =J27/SUM(J9:J46) -> 0 | M27: =L27/SUM(L9:L46) -> 0 | N27: 1 | O27: =N27/SUM(N9:N46) -> 1.1111111111111112E-2 | P27: 1 | Q27: =P27/SUM(P9:P46) -> 1.6129032258064516E-2
A28: Eulogy To Lenny Bruce | C28: =B28/SUM(B9:B46) -> 0 | E28: =D28/SUM(D9:D46) -> 0 | G28: =F28/SUM(F9:F46) -> 0 | I28: =H28/SUM(H9:H46) -> 0 | K28: =J28/SUM(J9:J46) -> 0 | M28: =L28/SUM(L9:L46) -> 0 | O28: =N28/SUM(N9:N46) -> 0 | P28: 1 | Q28: =P28/SUM(P9:P46) -> 1.6129032258064516E-2
A29: Kinetoscope | C29: =B29/SUM(B9:B46) -> 0 | E29: =D29/SUM(D9:D46) -> 0 | G29: =F29/SUM(F9:F46) -> 0 | I29: =H29/SUM(H9:H46) -> 0 | K29: =J29/SUM(J9:J46) -> 0 | M29: =L29/SUM(L9:L46) -> 0 | O29: =N29/SUM(N9:N46) -> 0 | P29: 1 | Q29: =P29/SUM(P9:P46) -> 1.6129032258064516E-2
A30: The New World | C30: =B30/SUM(B9:B46) -> 0 | E30: =D30/SUM(D9:D46) -> 0 | G30: =F30/SUM(F9:F46) -> 0 | I30: =H30/SUM(H9:H46) -> 0 | K30: =J30/SUM(J9:J46) -> 0 | M30: =L30/SUM(L9:L46) -> 0 | O30: =N30/SUM(N9:N46) -> 0 | P30: 1 | Q30: =P30/SUM(P9:P46) -> 1.6129032258064516E-2
A31: In The Sun | C31: =B31/SUM(B9:B46) -> 0 | E31: =D31/SUM(D9:D46) -> 0 | G31: =F31/SUM(F9:F46) -> 0 | I31: =H31/SUM(H9:H46) -> 0 | J31: 5 | K31: =J31/SUM(J9:J46) -> 6.5789473684210523E-2 | L31: 3 | M31: =L31/SUM(L9:L46) -> 4.4117647058823532E-2 | O31: =N31/SUM(N9:N46) -> 0 | P31: 1 | Q31: =P31/SUM(P9:P46) -> 1.6129032258064516E-2
A32: Spirit of Love | C32: =B32/SUM(B9:B46) -> 0 | E32: =D32/SUM(D9:D46) -> 0 | G32: =F32/SUM(F9:F46) -> 0 | I32: =H32/SUM(H9:H46) -> 0 | K32: =J32/SUM(J9:J46) -> 0 | M32: =L32/SUM(L9:L46) -> 0 | O32: =N32/SUM(N9:N46) -> 0 | P32: 1 | Q32: =P32/SUM(P9:P46) -> 1.6129032258064516E-2
A33: Translucent Carriages | C33: =B33/SUM(B9:B46) -> 0 | E33: =D33/SUM(D9:D46) -> 0 | G33: =F33/SUM(F9:F46) -> 0 | I33: =H33/SUM(H9:H46) -> 0 | K33: =J33/SUM(J9:J46) -> 0 | M33: =L33/SUM(L9:L46) -> 0 | O33: =N33/SUM(N9:N46) -> 0 | P33: 1 | Q33: =P33/SUM(P9:P46) -> 1.6129032258064516E-2
A34: The Mirror Phase | C34: =B34/SUM(B9:B46) -> 0 | E34: =D34/SUM(D9:D46) -> 0 | G34: =F34/SUM(F9:F46) -> 0 | I34: =H34/SUM(H9:H46) -> 0 | K34: =J34/SUM(J9:J46) -> 0 | M34: =L34/SUM(L9:L46) -> 0 | O34: =N34/SUM(N9:N46) -> 0 | P34: 1 | Q34: =P34/SUM(P9:P46) -> 1.6129032258064516E-2
A35: Can't Get You Out Of My Head | C35: =B35/SUM(B9:B46) -> 0 | E35: =D35/SUM(D9:D46) -> 0 | G35: =F35/SUM(F9:F46) -> 0 | I35: =H35/SUM(H9:H46) -> 0 | K35: =J35/SUM(J9:J46) -> 0 | M35: =L35/SUM(L9:L46) -> 0 | O35: =N35/SUM(N9:N46) -> 0 | P35: 1 | Q35: =P35/SUM(P9:P46) -> 1.6129032258064516E-2
A36: Astrafiamante | C36: =B36/SUM(B9:B46) -> 0 | E36: =D36/SUM(D9:D46) -> 0 | F36: 2 | G36: =F36/SUM(F9:F46) -> 3.4482758620689655E-2 | I36: =H36/SUM(H9:H46) -> 0 | J36: 3 | K36: =J36/SUM(J9:J46) -> 3.9473684210526314E-2 | M36: =L36/SUM(L9:L46) -> 0 | N36: 3 | O36: =N36/SUM(N9:N46) -> 3.3333333333333333E-2 | Q36: =P36/SUM(P9:P46) -> 0
A37: Once More | C37: =B37/SUM(B9:B46) -> 0 | E37: =D37/SUM(D9:D46) -> 0 | G37: =F37/SUM(F9:F46) -> 0 | I37: =H37/SUM(H9:H46) -> 0 | K37: =J37/SUM(J9:J46) -> 0 | M37: =L37/SUM(L9:L46) -> 0 | N37: 2 | O37: =N37/SUM(N9:N46) -> 2.2222222222222223E-2 | Q37: =P37/SUM(P9:P46) -> 0
A38: Awake In A Muddle | C38: =B38/SUM(B9:B46) -> 0 | E38: =D38/SUM(D9:D46) -> 0 | G38: =F38/SUM(F9:F46) -> 0 | I38: =H38/SUM(H9:H46) -> 0 | K38: =J38/SUM(J9:J46) -> 0 | M38: =L38/SUM(L9:L46) -> 0 | N38: 1 | O38: =N38/SUM(N9:N46) -> 1.1111111111111112E-2 | Q38: =P38/SUM(P9:P46) -> 0
A39: How Long | C39: =B39/SUM(B9:B46) -> 0 | E39: =D39/SUM(D9:D46) -> 0 | F39: 2 | G39: =F39/SUM(F9:F46) -> 3.4482758620689655E-2 | I39: =H39/SUM(H9:H46) -> 0 | K39: =J39/SUM(J9:J46) -> 0 | M39: =L39/SUM(L9:L46) -> 0 | N39: 1 | O39: =N39/SUM(N9:N46) -> 1.1111111111111112E-2 | Q39: =P39/SUM(P9:P46) -> 0
A40: In The Morning | C40: =B40/SUM(B9:B46) -> 0 | E40: =D40/SUM(D9:D46) -> 0 | F40: 2 | G40: =F40/SUM(F9:F46) -> 3.4482758620689655E-2 | I40: =H40/SUM(H9:H46) -> 0 | K40: =J40/SUM(J9:J46) -> 0 | L40: 5 | M40: =L40/SUM(L9:L46) -> 7.3529411764705885E-2 | N40: 1 | O40: =N40/SUM(N9:N46) -> 1.1111111111111112E-2 | Q40: =P40/SUM(P9:P46) -> 0
A41: Memories | C41: =B41/SUM(B9:B46) -> 0 | E41: =D41/SUM(D9:D46) -> 0 | F41: 2 | G41: =F41/SUM(F9:F46) -> 3.4482758620689655E-2 | I41: =H41/SUM(H9:H46) -> 0 | K41: =J41/SUM(J9:J46) -> 0 | M41: =L41/SUM(L9:L46) -> 0 | N41: 1 | O41: =N41/SUM(N9:N46) -> 1.1111111111111112E-2 | Q41: =P41/SUM(P9:P46) -> 0
A42: The New Historicism | C42: =B42/SUM(B9:B46) -> 0 | E42: =D42/SUM(D9:D46) -> 0 | F42: 4 | G42: =F42/SUM(F9:F46) -> 6.8965517241379309E-2 | I42: =H42/SUM(H9:H46) -> 0 | K42: =J42/SUM(J9:J46) -> 0 | M42: =L42/SUM(L9:L46) -> 0 | N42: 1 | O42: =N42/SUM(N9:N46) -> 1.1111111111111112E-2 | Q42: =P42/SUM(P9:P46) -> 0
A43: Who Am I | C43: =B43/SUM(B9:B46) -> 0 | E43: =D43/SUM(D9:D46) -> 0 | F43: 2 | G43: =F43/SUM(F9:F46) -> 3.4482758620689655E-2 | I43: =H43/SUM(H9:H46) -> 0 | K43: =J43/SUM(J9:J46) -> 0 | M43: =L43/SUM(L9:L46) -> 0 | N43: 1 | O43: =N43/SUM(N9:N46) -> 1.1111111111111112E-2 | Q43: =P43/SUM(P9:P46) -> 0
A44: Yoo Doo Right | C44: =B44/SUM(B9:B46) -> 0 | E44: =D44/SUM(D9:D46) -> 0 | G44: =F44/SUM(F9:F46) -> 0 | I44: =H44/SUM(H9:H46) -> 0 | K44: =J44/SUM(J9:J46) -> 0 | M44: =L44/SUM(L9:L46) -> 0 | N44: 1 | O44: =N44/SUM(N9:N46) -> 1.1111111111111112E-2 | Q44: =P44/SUM(P9:P46) -> 0
A45: We're Not There | C45: =B45/SUM(B9:B46) -> 0 | E45: =D45/SUM(D9:D46) -> 0 | G45: =F45/SUM(F9:F46) -> 0 | I45: =H45/SUM(H9:H46) -> 0 | J45: 3 | K45: =J45/SUM(J9:J46) -> 3.9473684210526314E-2 | M45: =L45/SUM(L9:L46) -> 0 | O45: =N45/SUM(N9:N46) -> 0 | Q45: =P45/SUM(P9:P46) -> 0
A46: Whispering Pines | C46: =B46/SUM(B9:B46) -> 0 | E46: =D46/SUM(D9:D46) -> 0 | F46: 4 | G46: =F46/SUM(F9:F46) -> 6.8965517241379309E-2 | I46: =H46/SUM(H9:H46) -> 0 | K46: =J46/SUM(J9:J46) -> 0 | M46: =L46/SUM(L9:L46) -> 0 | O46: =N46/SUM(N9:N46) -> 0 | Q46: =P46/SUM(P9:P46) -> 0