A1: Galaxie 500 Mailing List // Survey Results // 1995 - 2002
A2: Luna album | B2: 35034 | D2: 35217 | F2: 35400 | H2: 35582 | J2: 35947 | L2: 36312 | N2: 36708 | P2: 37591
A3: Lunapark | B3: 18 | C3: =B3/SUM(B3:B8) -> 0.41860465116279072 | D3: 14 | E3: =D3/SUM(D3:D8) -> 0.41176470588235292 | F3: 20 | G3: =F3/SUM(F3:F8) -> 0.35087719298245612 | H3: 19 | I3: =H3/SUM(H3:H8) -> 0.32203389830508472 | J3: 16 | K3: =J3/SUM(J3:J8) -> 0.2318840579710145 | L3: 14 | M3: =L3/SUM(L3:L8) -> 0.23333333333333334 | N3: 9 | O3: =N3/SUM(N3:N8) -> 0.13043478260869565 | P3: 8 | Q3: =P3/SUM(P3:P8) -> 0.1
A4: Bewitched | B4: 18 | C4: =B4/SUM(B3:B8) -> 0.41860465116279072 | D4: 10 | E4: =D4/SUM(D3:D8) -> 0.29411764705882354 | F4: 17 | G4: =F4/SUM(F3:F8) -> 0.2982456140350877 | H4: 21 | I4: =H4/SUM(H3:H8) -> 0.3559322033898305 | J4: 18 | K4: =J4/SUM(J3:J8) -> 0.2608695652173913 | L4: 12 | M4: =L4/SUM(L3:L8) -> 0.2 | N4: 18 | O4: =N4/SUM(N3:N8) -> 0.2608695652173913 | P4: 12 | Q4: =P4/SUM(P3:P8) -> 0.15
A5: Penthouse | B5: 7 | C5: =B5/SUM(B3:B8) -> 0.16279069767441862 | D5: 10 | E5: =D5/SUM(D3:D8) -> 0.29411764705882354 | F5: 20 | G5: =F5/SUM(F3:F8) -> 0.35087719298245612 | H5: 19 | I5: =H5/SUM(H3:H8) -> 0.32203389830508472 | J5: 30 | K5: =J5/SUM(J3:J8) -> 0.43478260869565216 | L5: 24 | M5: =L5/SUM(L3:L8) -> 0.4 | N5: 32 | O5: =N5/SUM(N3:N8) -> 0.46376811594202899 | P5: 39 | Q5: =P5/SUM(P3:P8) -> 0.48749999999999999
A6: Pup Tent | C6: =B6/SUM(B3:B8) -> 0 | E6: =D6/SUM(D3:D8) -> 0 | G6: =F6/SUM(F3:F8) -> 0 | I6: =H6/SUM(H3:H8) -> 0 | J6: 5 | K6: =J6/SUM(J3:J8) -> 7.2463768115942032E-2 | L6: 3 | M6: =L6/SUM(L3:L8) -> 0.05 | N6: 6 | O6: =N6/SUM(N3:N8) -> 8.6956521739130432E-2 | P6: 10 | Q6: =P6/SUM(P3:P8) -> 0.125
A7: Days Of Our Nights | C7: =B7/SUM(B3:B8) -> 0 | E7: =D7/SUM(D3:D8) -> 0 | G7: =F7/SUM(F3:F8) -> 0 | I7: =H7/SUM(H3:H8) -> 0 | K7: =J7/SUM(J3:J8) -> 0 | L7: 7 | M7: =L7/SUM(L3:L8) -> 0.11666666666666667 | N7: 4 | O7: =N7/SUM(N3:N8) -> 5.7971014492753624E-2 | P7: 4 | Q7: =P7/SUM(P3:P8) -> 0.05
A8: Romantica | C8: =B8/SUM(B3:B8) -> 0 | E8: =D8/SUM(D3:D8) -> 0 | G8: =F8/SUM(F3:F8) -> 0 | I8: =H8/SUM(H3:H8) -> 0 | K8: =J8/SUM(J3:J8) -> 0 | M8: =L8/SUM(L3:L8) -> 0 | O8: =N8/SUM(N3:N8) -> 0 | P8: 7 | Q8: =P8/SUM(P3:P8) -> 8.7499999999999994E-2
A10: Luna song | B10: 35034 | D10: 35217 | F10: 35400 | H10: 35582 | J10: 35947 | L10: 36312 | N10: 36708 | P10: 37591
A11: 23 Minutes In Brussels | B11: 2 | C11: =B11/SUM(B11:B74) -> 0.11764705882352941 | D11: 3 | E11: =D11/SUM(D11:D74) -> 0.13636363636363635 | F11: 10 | G11: =F11/SUM(F11:F74) -> 6.9930069930069935E-2 | H11: 13 | I11: =H11/SUM(H11:H74) -> 0.12871287128712872 | J11: 15 | K11: =J11/SUM(J11:J74) -> 9.202453987730061E-2 | L11: 19 | M11: =L11/SUM(L11:L74) -> 0.1357142857142857 | N11: 23 | O11: =N11/SUM(N11:N74) -> 0.11386138613861387 | P11: 30 | Q11: =P11/SUM(P11:P74) -> 0.13513513513513514
A12: Chinatown | C12: =B12/SUM(B11:B74) -> 0 | E12: =D12/SUM(D11:D74) -> 0 | G12: =F12/SUM(F11:F74) -> 0 | H12: 5 | I12: =H12/SUM(H11:H74) -> 4.9504950495049507E-2 | J12: 3 | K12: =J12/SUM(J11:J74) -> 1.8404907975460124E-2 | L12: 7 | M12: =L12/SUM(L11:L74) -> 0.05 | N12: 9 | O12: =N12/SUM(N11:N74) -> 4.4554455445544552E-2 | P12: 17 | Q12: =P12/SUM(P11:P74) -> 7.6576576576576572E-2
A13: Slash Your Tires | C13: =B13/SUM(B11:B74) -> 0 | E13: =D13/SUM(D11:D74) -> 0 | F13: 9 | G13: =F13/SUM(F11:F74) -> 6.2937062937062943E-2 | H13: 6 | I13: =H13/SUM(H11:H74) -> 5.9405940594059403E-2 | J13: 10 | K13: =J13/SUM(J11:J74) -> 6.1349693251533742E-2 | L13: 7 | M13: =L13/SUM(L11:L74) -> 0.05 | N13: 12 | O13: =N13/SUM(N11:N74) -> 5.9405940594059403E-2 | P13: 13 | Q13: =P13/SUM(P11:P74) -> 5.8558558558558557E-2
A14: California (All The Way) | B14: 8 | C14: =B14/SUM(B11:B74) -> 0.47058823529411764 | D14: 5 | E14: =D14/SUM(D11:D74) -> 0.22727272727272727 | F14: 12 | G14: =F14/SUM(F11:F74) -> 8.3916083916083919E-2 | H14: 13 | I14: =H14/SUM(H11:H74) -> 0.12871287128712872 | J14: 13 | K14: =J14/SUM(J11:J74) -> 7.9754601226993863E-2 | L14: 16 | M14: =L14/SUM(L11:L74) -> 0.11428571428571428 | N14: 12 | O14: =N14/SUM(N11:N74) -> 5.9405940594059403E-2 | P14: 10 | Q14: =P14/SUM(P11:P74) -> 4.5045045045045043E-2
A15: Superfreaky Memories | C15: =B15/SUM(B11:B74) -> 0 | E15: =D15/SUM(D11:D74) -> 0 | G15: =F15/SUM(F11:F74) -> 0 | I15: =H15/SUM(H11:H74) -> 0 | K15: =J15/SUM(J11:J74) -> 0 | L15: 9 | M15: =L15/SUM(L11:L74) -> 6.4285714285714279E-2 | N15: 4 | O15: =N15/SUM(N11:N74) -> 1.9801980198019802E-2 | P15: 9 | Q15: =P15/SUM(P11:P74) -> 4.0540540540540543E-2
A16: Time to Quit | C16: =B16/SUM(B11:B74) -> 0 | E16: =D16/SUM(D11:D74) -> 0 | F16: 3 | G16: =F16/SUM(F11:F74) -> 2.097902097902098E-2 | I16: =H16/SUM(H11:H74) -> 0 | J16: 5 | K16: =J16/SUM(J11:J74) -> 3.0674846625766871E-2 | M16: =L16/SUM(L11:L74) -> 0 | N16: 6 | O16: =N16/SUM(N11:N74) -> 2.9702970297029702E-2 | P16: 9 | Q16: =P16/SUM(P11:P74) -> 4.0540540540540543E-2
A17: Friendly Advice | C17: =B17/SUM(B11:B74) -> 0 | D17: 2 | E17: =D17/SUM(D11:D74) -> 9.0909090909090912E-2 | F17: 7 | G17: =F17/SUM(F11:F74) -> 4.8951048951048952E-2 | H17: 11 | I17: =H17/SUM(H11:H74) -> 0.10891089108910891 | J17: 9 | K17: =J17/SUM(J11:J74) -> 5.5214723926380369E-2 | L17: 10 | M17: =L17/SUM(L11:L74) -> 7.1428571428571425E-2 | N17: 13 | O17: =N17/SUM(N11:N74) -> 6.4356435643564358E-2 | P17: 8 | Q17: =P17/SUM(P11:P74) -> 3.6036036036036036E-2
A18: Bewitched | C18: =B18/SUM(B11:B74) -> 0 | E18: =D18/SUM(D11:D74) -> 0 | G18: =F18/SUM(F11:F74) -> 0 | I18: =H18/SUM(H11:H74) -> 0 | K18: =J18/SUM(J11:J74) -> 0 | M18: =L18/SUM(L11:L74) -> 0 | N18: 3 | O18: =N18/SUM(N11:N74) -> 1.4851485148514851E-2 | P18: 8 | Q18: =P18/SUM(P11:P74) -> 3.6036036036036036E-2
A19: Moon Palace | C19: =B19/SUM(B11:B74) -> 0 | E19: =D19/SUM(D11:D74) -> 0 | F19: 8 | G19: =F19/SUM(F11:F74) -> 5.5944055944055944E-2 | I19: =H19/SUM(H11:H74) -> 0 | J19: 7 | K19: =J19/SUM(J11:J74) -> 4.2944785276073622E-2 | L19: 9 | M19: =L19/SUM(L11:L74) -> 6.4285714285714279E-2 | N19: 10 | O19: =N19/SUM(N11:N74) -> 4.9504950495049507E-2 | P19: 7 | Q19: =P19/SUM(P11:P74) -> 3.1531531531531529E-2
A20: Tiger Lily | B20: 4 | C20: =B20/SUM(B11:B74) -> 0.23529411764705882 | D20: 2 | E20: =D20/SUM(D11:D74) -> 9.0909090909090912E-2 | F20: 7 | G20: =F20/SUM(F11:F74) -> 4.8951048951048952E-2 | H20: 14 | I20: =H20/SUM(H11:H74) -> 0.13861386138613863 | J20: 6 | K20: =J20/SUM(J11:J74) -> 3.6809815950920248E-2 | L20: 4 | M20: =L20/SUM(L11:L74) -> 2.8571428571428571E-2 | N20: 9 | O20: =N20/SUM(N11:N74) -> 4.4554455445544552E-2 | P20: 7 | Q20: =P20/SUM(P11:P74) -> 3.1531531531531529E-2
A21: Bobby Peru | C21: =B21/SUM(B11:B74) -> 0 | E21: =D21/SUM(D11:D74) -> 0 | G21: =F21/SUM(F11:F74) -> 0 | I21: =H21/SUM(H11:H74) -> 0 | J21: 7 | K21: =J21/SUM(J11:J74) -> 4.2944785276073622E-2 | L21: 5 | M21: =L21/SUM(L11:L74) -> 3.5714285714285712E-2 | N21: 10 | O21: =N21/SUM(N11:N74) -> 4.9504950495049507E-2 | P21: 6 | Q21: =P21/SUM(P11:P74) -> 2.7027027027027029E-2
A22: Sideshow by the Seashore | C22: =B22/SUM(B11:B74) -> 0 | E22: =D22/SUM(D11:D74) -> 0 | F22: 5 | G22: =F22/SUM(F11:F74) -> 3.4965034965034968E-2 | H22: 6 | I22: =H22/SUM(H11:H74) -> 5.9405940594059403E-2 | J22: 9 | K22: =J22/SUM(J11:J74) -> 5.5214723926380369E-2 | L22: 3 | M22: =L22/SUM(L11:L74) -> 2.1428571428571429E-2 | N22: 6 | O22: =N22/SUM(N11:N74) -> 2.9702970297029702E-2 | P22: 6 | Q22: =P22/SUM(P11:P74) -> 2.7027027027027029E-2
A23: Anesthesia | C23: =B23/SUM(B11:B74) -> 0 | D23: 2 | E23: =D23/SUM(D11:D74) -> 9.0909090909090912E-2 | F23: 11 | G23: =F23/SUM(F11:F74) -> 7.6923076923076927E-2 | H23: 13 | I23: =H23/SUM(H11:H74) -> 0.12871287128712872 | J23: 10 | K23: =J23/SUM(J11:J74) -> 6.1349693251533742E-2 | L23: 9 | M23: =L23/SUM(L11:L74) -> 6.4285714285714279E-2 | N23: 5 | O23: =N23/SUM(N11:N74) -> 2.4752475247524754E-2 | P23: 6 | Q23: =P23/SUM(P11:P74) -> 2.7027027027027029E-2
A24: Freakin' and Peakin' | C24: =B24/SUM(B11:B74) -> 0 | E24: =D24/SUM(D11:D74) -> 0 | F24: 3 | G24: =F24/SUM(F11:F74) -> 2.097902097902098E-2 | I24: =H24/SUM(H11:H74) -> 0 | K24: =J24/SUM(J11:J74) -> 0 | M24: =L24/SUM(L11:L74) -> 0 | N24: 7 | O24: =N24/SUM(N11:N74) -> 3.4653465346534656E-2 | P24: 5 | Q24: =P24/SUM(P11:P74) -> 2.2522522522522521E-2
A25: Slide | C25: =B25/SUM(B11:B74) -> 0 | D25: 3 | E25: =D25/SUM(D11:D74) -> 0.13636363636363635 | F25: 11 | G25: =F25/SUM(F11:F74) -> 7.6923076923076927E-2 | H25: 6 | I25: =H25/SUM(H11:H74) -> 5.9405940594059403E-2 | J25: 7 | K25: =J25/SUM(J11:J74) -> 4.2944785276073622E-2 | L25: 5 | M25: =L25/SUM(L11:L74) -> 3.5714285714285712E-2 | N25: 6 | O25: =N25/SUM(N11:N74) -> 2.9702970297029702E-2 | P25: 5 | Q25: =P25/SUM(P11:P74) -> 2.2522522522522521E-2
A26: Lost In Space | C26: =B26/SUM(B11:B74) -> 0 | E26: =D26/SUM(D11:D74) -> 0 | F26: 2 | G26: =F26/SUM(F11:F74) -> 1.3986013986013986E-2 | I26: =H26/SUM(H11:H74) -> 0 | J26: 7 | K26: =J26/SUM(J11:J74) -> 4.2944785276073622E-2 | M26: =L26/SUM(L11:L74) -> 0 | N26: 3 | O26: =N26/SUM(N11:N74) -> 1.4851485148514851E-2 | P26: 5 | Q26: =P26/SUM(P11:P74) -> 2.2522522522522521E-2
A27: This Time Around | C27: =B27/SUM(B11:B74) -> 0 | E27: =D27/SUM(D11:D74) -> 0 | F27: 4 | G27: =F27/SUM(F11:F74) -> 2.7972027972027972E-2 | I27: =H27/SUM(H11:H74) -> 0 | J27: 3 | K27: =J27/SUM(J11:J74) -> 1.8404907975460124E-2 | L27: 3 | M27: =L27/SUM(L11:L74) -> 2.1428571428571429E-2 | N27: 1 | O27: =N27/SUM(N11:N74) -> 4.9504950495049506E-3 | P27: 5 | Q27: =P27/SUM(P11:P74) -> 2.2522522522522521E-2
A28: Indian Summer | C28: =B28/SUM(B11:B74) -> 0 | E28: =D28/SUM(D11:D74) -> 0 | F28: 3 | G28: =F28/SUM(F11:F74) -> 2.097902097902098E-2 | H28: 7 | I28: =H28/SUM(H11:H74) -> 6.9306930693069313E-2 | J28: 12 | K28: =J28/SUM(J11:J74) -> 7.3619631901840496E-2 | L28: 10 | M28: =L28/SUM(L11:L74) -> 7.1428571428571425E-2 | N28: 8 | O28: =N28/SUM(N11:N74) -> 3.9603960396039604E-2 | P28: 4 | Q28: =P28/SUM(P11:P74) -> 1.8018018018018018E-2
A29: Tracy I Love You | C29: =B29/SUM(B11:B74) -> 0 | E29: =D29/SUM(D11:D74) -> 0 | G29: =F29/SUM(F11:F74) -> 0 | I29: =H29/SUM(H11:H74) -> 0 | J29: 4 | K29: =J29/SUM(J11:J74) -> 2.4539877300613498E-2 | L29: 4 | M29: =L29/SUM(L11:L74) -> 2.8571428571428571E-2 | N29: 4 | O29: =N29/SUM(N11:N74) -> 1.9801980198019802E-2 | P29: 4 | Q29: =P29/SUM(P11:P74) -> 1.8018018018018018E-2
A30: 1995 | C30: =B30/SUM(B11:B74) -> 0 | E30: =D30/SUM(D11:D74) -> 0 | G30: =F30/SUM(F11:F74) -> 0 | I30: =H30/SUM(H11:H74) -> 0 | K30: =J30/SUM(J11:J74) -> 0 | M30: =L30/SUM(L11:L74) -> 0 | O30: =N30/SUM(N11:N74) -> 0 | P30: 4 | Q30: =P30/SUM(P11:P74) -> 1.8018018018018018E-2
A31: Pup Tent | C31: =B31/SUM(B11:B74) -> 0 | E31: =D31/SUM(D11:D74) -> 0 | G31: =F31/SUM(F11:F74) -> 0 | I31: =H31/SUM(H11:H74) -> 0 | K31: =J31/SUM(J11:J74) -> 0 | L31: 4 | M31: =L31/SUM(L11:L74) -> 2.8571428571428571E-2 | N31: 2 | O31: =N31/SUM(N11:N74) -> 9.9009900990099011E-3 | P31: 4 | Q31: =P31/SUM(P11:P74) -> 1.8018018018018018E-2
A32: Dear Diary | C32: =B32/SUM(B11:B74) -> 0 | E32: =D32/SUM(D11:D74) -> 0 | G32: =F32/SUM(F11:F74) -> 0 | I32: =H32/SUM(H11:H74) -> 0 | K32: =J32/SUM(J11:J74) -> 0 | M32: =L32/SUM(L11:L74) -> 0 | N32: 6 | O32: =N32/SUM(N11:N74) -> 2.9702970297029702E-2 | P32: 3 | Q32: =P32/SUM(P11:P74) -> 1.3513513513513514E-2
A33: City Kitty | C33: =B33/SUM(B11:B74) -> 0 | E33: =D33/SUM(D11:D74) -> 0 | G33: =F33/SUM(F11:F74) -> 0 | I33: =H33/SUM(H11:H74) -> 0 | J33: 3 | K33: =J33/SUM(J11:J74) -> 1.8404907975460124E-2 | M33: =L33/SUM(L11:L74) -> 0 | N33: 3 | O33: =N33/SUM(N11:N74) -> 1.4851485148514851E-2 | P33: 3 | Q33: =P33/SUM(P11:P74) -> 1.3513513513513514E-2
A34: Beautiful View | C34: =B34/SUM(B11:B74) -> 0 | E34: =D34/SUM(D11:D74) -> 0 | G34: =F34/SUM(F11:F74) -> 0 | I34: =H34/SUM(H11:H74) -> 0 | J34: 3 | K34: =J34/SUM(J11:J74) -> 1.8404907975460124E-2 | M34: =L34/SUM(L11:L74) -> 0 | N34: 2 | O34: =N34/SUM(N11:N74) -> 9.9009900990099011E-3 | P34: 3 | Q34: =P34/SUM(P11:P74) -> 1.3513513513513514E-2
A35: Bonnie & Clyde | C35: =B35/SUM(B12:B75) -> 0 | E35: =D35/SUM(D12:D75) -> 0 | F35: 4 | G35: =F35/SUM(F12:F75) -> 3.007518796992481E-2 | I35: =H35/SUM(H12:H75) -> 0 | J35: 4 | K35: =J35/SUM(J12:J75) -> 2.7027027027027029E-2 | M35: =L35/SUM(L12:L75) -> 0 | N35: 2 | O35: =N35/SUM(N12:N75) -> 1.11731843575419E-2 | P35: 3 | Q35: =P35/SUM(P12:P75) -> 1.5625E-2
A36: Egg Nog | C36: =B36/SUM(B11:B74) -> 0 | E36: =D36/SUM(D11:D74) -> 0 | G36: =F36/SUM(F11:F74) -> 0 | I36: =H36/SUM(H11:H74) -> 0 | K36: =J36/SUM(J11:J74) -> 0 | M36: =L36/SUM(L11:L74) -> 0 | N36: 1 | O36: =N36/SUM(N11:N74) -> 4.9504950495049506E-3 | P36: 3 | Q36: =P36/SUM(P11:P74) -> 1.3513513513513514E-2
A37: Fuzzy Wuzzy | C37: =B37/SUM(B11:B74) -> 0 | E37: =D37/SUM(D11:D74) -> 0 | G37: =F37/SUM(F11:F74) -> 0 | I37: =H37/SUM(H11:H74) -> 0 | J37: 4 | K37: =J37/SUM(J11:J74) -> 2.4539877300613498E-2 | M37: =L37/SUM(L11:L74) -> 0 | N37: 1 | O37: =N37/SUM(N11:N74) -> 4.9504950495049506E-3 | P37: 3 | Q37: =P37/SUM(P11:P74) -> 1.3513513513513514E-2
A38: Going Home | C38: =B38/SUM(B11:B74) -> 0 | E38: =D38/SUM(D11:D74) -> 0 | F38: 2 | G38: =F38/SUM(F11:F74) -> 1.3986013986013986E-2 | I38: =H38/SUM(H11:H74) -> 0 | K38: =J38/SUM(J11:J74) -> 0 | M38: =L38/SUM(L11:L74) -> 0 | N38: 1 | O38: =N38/SUM(N11:N74) -> 4.9504950495049506E-3 | P38: 3 | Q38: =P38/SUM(P11:P74) -> 1.3513513513513514E-2
A39: Kalamazoo | C39: =B39/SUM(B11:B74) -> 0 | E39: =D39/SUM(D11:D74) -> 0 | F39: 2 | G39: =F39/SUM(F11:F74) -> 1.3986013986013986E-2 | I39: =H39/SUM(H11:H74) -> 0 | J39: 4 | K39: =J39/SUM(J11:J74) -> 2.4539877300613498E-2 | M39: =L39/SUM(L11:L74) -> 0 | N39: 1 | O39: =N39/SUM(N11:N74) -> 4.9504950495049506E-3 | P39: 2 | Q39: =P39/SUM(P11:P74) -> 9.0090090090090089E-3
A40: Rhythm King | C40: =B40/SUM(B11:B74) -> 0 | E40: =D40/SUM(D11:D74) -> 0 | F40: 2 | G40: =F40/SUM(F11:F74) -> 1.3986013986013986E-2 | I40: =H40/SUM(H11:H74) -> 0 | K40: =J40/SUM(J11:J74) -> 0 | M40: =L40/SUM(L11:L74) -> 0 | N40: 1 | O40: =N40/SUM(N11:N74) -> 4.9504950495049506E-3 | P40: 2 | Q40: =P40/SUM(P11:P74) -> 9.0090090090090089E-3
A41: Lovedust | C41: =B41/SUM(B11:B74) -> 0 | E41: =D41/SUM(D11:D74) -> 0 | G41: =F41/SUM(F11:F74) -> 0 | I41: =H41/SUM(H11:H74) -> 0 | K41: =J41/SUM(J11:J74) -> 0 | M41: =L41/SUM(L11:L74) -> 0 | O41: =N41/SUM(N11:N74) -> 0 | P41: 2 | Q41: =P41/SUM(P11:P74) -> 9.0090090090090089E-3
A42: Weird and Woozy | C42: =B42/SUM(B11:B74) -> 0 | E42: =D42/SUM(D11:D74) -> 0 | G42: =F42/SUM(F11:F74) -> 0 | I42: =H42/SUM(H11:H74) -> 0 | K42: =J42/SUM(J11:J74) -> 0 | M42: =L42/SUM(L11:L74) -> 0 | O42: =N42/SUM(N11:N74) -> 0 | P42: 2 | Q42: =P42/SUM(P11:P74) -> 9.0090090090090089E-3
A43: Astronaut | C43: =B43/SUM(B11:B74) -> 0 | E43: =D43/SUM(D11:D74) -> 0 | G43: =F43/SUM(F11:F74) -> 0 | I43: =H43/SUM(H11:H74) -> 0 | K43: =J43/SUM(J11:J74) -> 0 | M43: =L43/SUM(L11:L74) -> 0 | O43: =N43/SUM(N11:N74) -> 0 | P43: 2 | Q43: =P43/SUM(P11:P74) -> 9.0090090090090089E-3
A44: Black Champagne | C44: =B44/SUM(B11:B74) -> 0 | E44: =D44/SUM(D11:D74) -> 0 | G44: =F44/SUM(F11:F74) -> 0 | I44: =H44/SUM(H11:H74) -> 0 | K44: =J44/SUM(J11:J74) -> 0 | M44: =L44/SUM(L11:L74) -> 0 | O44: =N44/SUM(N11:N74) -> 0 | P44: 2 | Q44: =P44/SUM(P11:P74) -> 9.0090090090090089E-3
A45: I Want Everything | B45: 3 | C45: =B45/SUM(B11:B74) -> 0.17647058823529413 | D45: 3 | E45: =D45/SUM(D11:D74) -> 0.13636363636363635 | F45: 7 | G45: =F45/SUM(F11:F74) -> 4.8951048951048952E-2 | H45: 7 | I45: =H45/SUM(H11:H74) -> 6.9306930693069313E-2 | J45: 10 | K45: =J45/SUM(J11:J74) -> 6.1349693251533742E-2 | L45: 3 | M45: =L45/SUM(L11:L74) -> 2.1428571428571429E-2 | N45: 5 | O45: =N45/SUM(N11:N74) -> 2.4752475247524754E-2 | P45: 1 | Q45: =P45/SUM(P11:P74) -> 4.5045045045045045E-3
A46: Hedgehog | C46: =B46/SUM(B11:B74) -> 0 | E46: =D46/SUM(D11:D74) -> 0 | F46: 3 | G46: =F46/SUM(F11:F74) -> 2.097902097902098E-2 | I46: =H46/SUM(H11:H74) -> 0 | K46: =J46/SUM(J11:J74) -> 0 | M46: =L46/SUM(L11:L74) -> 0 | N46: 3 | O46: =N46/SUM(N11:N74) -> 1.4851485148514851E-2 | P46: 1 | Q46: =P46/SUM(P11:P74) -> 4.5045045045045045E-3
A47: IHOP | C47: =B47/SUM(B11:B74) -> 0 | E47: =D47/SUM(D11:D74) -> 0 | G47: =F47/SUM(F11:F74) -> 0 | I47: =H47/SUM(H11:H74) -> 0 | K47: =J47/SUM(J11:J74) -> 0 | M47: =L47/SUM(L11:L74) -> 0 | N47: 3 | O47: =N47/SUM(N11:N74) -> 1.4851485148514851E-2 | P47: 1 | Q47: =P47/SUM(P11:P74) -> 4.5045045045045045E-3
A48: Into The Fold | C48: =B48/SUM(B11:B74) -> 0 | E48: =D48/SUM(D11:D74) -> 0 | F48: 3 | G48: =F48/SUM(F11:F74) -> 2.097902097902098E-2 | I48: =H48/SUM(H11:H74) -> 0 | K48: =J48/SUM(J11:J74) -> 0 | M48: =L48/SUM(L11:L74) -> 0 | N48: 2 | O48: =N48/SUM(N11:N74) -> 9.9009900990099011E-3 | P48: 1 | Q48: =P48/SUM(P11:P74) -> 4.5045045045045045E-3
A49: Seven Steps to Satan | C49: =B49/SUM(B11:B74) -> 0 | E49: =D49/SUM(D11:D74) -> 0 | G49: =F49/SUM(F11:F74) -> 0 | I49: =H49/SUM(H11:H74) -> 0 | K49: =J49/SUM(J11:J74) -> 0 | M49: =L49/SUM(L11:L74) -> 0 | N49: 1 | O49: =N49/SUM(N11:N74) -> 4.9504950495049506E-3 | P49: 1 | Q49: =P49/SUM(P11:P74) -> 4.5045045045045045E-3
A50: We're Both Confused | C50: =B50/SUM(B11:B74) -> 0 | E50: =D50/SUM(D11:D74) -> 0 | F50: 6 | G50: =F50/SUM(F11:F74) -> 4.195804195804196E-2 | I50: =H50/SUM(H11:H74) -> 0 | K50: =J50/SUM(J11:J74) -> 0 | M50: =L50/SUM(L11:L74) -> 0 | N50: 1 | O50: =N50/SUM(N11:N74) -> 4.9504950495049506E-3 | P50: 1 | Q50: =P50/SUM(P11:P74) -> 4.5045045045045045E-3
A51: I Know You Tried | C51: =B51/SUM(B11:B74) -> 0 | E51: =D51/SUM(D11:D74) -> 0 | F51: 2 | G51: =F51/SUM(F11:F74) -> 1.3986013986013986E-2 | I51: =H51/SUM(H11:H74) -> 0 | K51: =J51/SUM(J11:J74) -> 0 | M51: =L51/SUM(L11:L74) -> 0 | O51: =N51/SUM(N11:N74) -> 0 | P51: 1 | Q51: =P51/SUM(P11:P74) -> 4.5045045045045045E-3
A52: Bad Vibe Merchant | C52: =B52/SUM(B11:B74) -> 0 | E52: =D52/SUM(D11:D74) -> 0 | G52: =F52/SUM(F11:F74) -> 0 | I52: =H52/SUM(H11:H74) -> 0 | K52: =J52/SUM(J11:J74) -> 0 | M52: =L52/SUM(L11:L74) -> 0 | O52: =N52/SUM(N11:N74) -> 0 | P52: 1 | Q52: =P52/SUM(P11:P74) -> 4.5045045045045045E-3
A53: Black Postcards | C53: =B53/SUM(B11:B74) -> 0 | E53: =D53/SUM(D11:D74) -> 0 | G53: =F53/SUM(F11:F74) -> 0 | I53: =H53/SUM(H11:H74) -> 0 | K53: =J53/SUM(J11:J74) -> 0 | M53: =L53/SUM(L11:L74) -> 0 | O53: =N53/SUM(N11:N74) -> 0 | P53: 1 | Q53: =P53/SUM(P11:P74) -> 4.5045045045045045E-3
A54: Double Feature | C54: =B54/SUM(B11:B74) -> 0 | E54: =D54/SUM(D11:D74) -> 0 | G54: =F54/SUM(F11:F74) -> 0 | I54: =H54/SUM(H11:H74) -> 0 | K54: =J54/SUM(J11:J74) -> 0 | M54: =L54/SUM(L11:L74) -> 0 | O54: =N54/SUM(N11:N74) -> 0 | P54: 1 | Q54: =P54/SUM(P11:P74) -> 4.5045045045045045E-3
A55: Mermaid Eyes | C55: =B55/SUM(B11:B74) -> 0 | E55: =D55/SUM(D11:D74) -> 0 | G55: =F55/SUM(F11:F74) -> 0 | I55: =H55/SUM(H11:H74) -> 0 | K55: =J55/SUM(J11:J74) -> 0 | M55: =L55/SUM(L11:L74) -> 0 | O55: =N55/SUM(N11:N74) -> 0 | P55: 1 | Q55: =P55/SUM(P11:P74) -> 4.5045045045045045E-3
A56: Renee is Crying | C56: =B56/SUM(B11:B74) -> 0 | E56: =D56/SUM(D11:D74) -> 0 | G56: =F56/SUM(F11:F74) -> 0 | I56: =H56/SUM(H11:H74) -> 0 | K56: =J56/SUM(J11:J74) -> 0 | M56: =L56/SUM(L11:L74) -> 0 | O56: =N56/SUM(N11:N74) -> 0 | P56: 1 | Q56: =P56/SUM(P11:P74) -> 4.5045045045045045E-3
A57: Swedish Fish | C57: =B57/SUM(B11:B74) -> 0 | E57: =D57/SUM(D11:D74) -> 0 | G57: =F57/SUM(F11:F74) -> 0 | I57: =H57/SUM(H11:H74) -> 0 | K57: =J57/SUM(J11:J74) -> 0 | M57: =L57/SUM(L11:L74) -> 0 | O57: =N57/SUM(N11:N74) -> 0 | P57: 1 | Q57: =P57/SUM(P11:P74) -> 4.5045045045045045E-3
A58: Teenage Lightning | C58: =B58/SUM(B11:B74) -> 0 | E58: =D58/SUM(D11:D74) -> 0 | G58: =F58/SUM(F11:F74) -> 0 | I58: =H58/SUM(H11:H74) -> 0 | K58: =J58/SUM(J11:J74) -> 0 | M58: =L58/SUM(L11:L74) -> 0 | O58: =N58/SUM(N11:N74) -> 0 | P58: 1 | Q58: =P58/SUM(P11:P74) -> 4.5045045045045045E-3
A59: The Rustler | C59: =B59/SUM(B11:B74) -> 0 | E59: =D59/SUM(D11:D74) -> 0 | G59: =F59/SUM(F11:F74) -> 0 | I59: =H59/SUM(H11:H74) -> 0 | K59: =J59/SUM(J11:J74) -> 0 | M59: =L59/SUM(L11:L74) -> 0 | O59: =N59/SUM(N11:N74) -> 0 | P59: 1 | Q59: =P59/SUM(P11:P74) -> 4.5045045045045045E-3
A60: The Old Fashioned Way | C60: =B60/SUM(B11:B74) -> 0 | E60: =D60/SUM(D11:D74) -> 0 | G60: =F60/SUM(F11:F74) -> 0 | I60: =H60/SUM(H11:H74) -> 0 | K60: =J60/SUM(J11:J74) -> 0 | M60: =L60/SUM(L11:L74) -> 0 | O60: =N60/SUM(N11:N74) -> 0 | P60: 1 | Q60: =P60/SUM(P11:P74) -> 4.5045045045045045E-3
A61: New Haven Comet | C61: =B61/SUM(B11:B74) -> 0 | E61: =D61/SUM(D11:D74) -> 0 | G61: =F61/SUM(F11:F74) -> 0 | I61: =H61/SUM(H11:H74) -> 0 | K61: =J61/SUM(J11:J74) -> 0 | M61: =L61/SUM(L11:L74) -> 0 | O61: =N61/SUM(N11:N74) -> 0 | P61: 1 | Q61: =P61/SUM(P11:P74) -> 4.5045045045045045E-3
A62: 4000 Days | C62: =B62/SUM(B11:B74) -> 0 | E62: =D62/SUM(D11:D74) -> 0 | G62: =F62/SUM(F11:F74) -> 0 | I62: =H62/SUM(H11:H74) -> 0 | K62: =J62/SUM(J11:J74) -> 0 | M62: =L62/SUM(L11:L74) -> 0 | N62: 2 | O62: =N62/SUM(N11:N74) -> 9.9009900990099011E-3 | Q62: =P62/SUM(P11:P74) -> 0
A63: Hello Little One | C63: =B63/SUM(B11:B74) -> 0 | E63: =D63/SUM(D11:D74) -> 0 | G63: =F63/SUM(F11:F74) -> 0 | I63: =H63/SUM(H11:H74) -> 0 | K63: =J63/SUM(J11:J74) -> 0 | M63: =L63/SUM(L11:L74) -> 0 | N63: 2 | O63: =N63/SUM(N11:N74) -> 9.9009900990099011E-3 | Q63: =P63/SUM(P11:P74) -> 0
A64: Math Wiz | C64: =B64/SUM(B11:B74) -> 0 | E64: =D64/SUM(D11:D74) -> 0 | G64: =F64/SUM(F11:F74) -> 0 | I64: =H64/SUM(H11:H74) -> 0 | K64: =J64/SUM(J11:J74) -> 0 | M64: =L64/SUM(L11:L74) -> 0 | N64: 2 | O64: =N64/SUM(N11:N74) -> 9.9009900990099011E-3 | Q64: =P64/SUM(P11:P74) -> 0
A65: Ride Into The Sun | C65: =B65/SUM(B11:B74) -> 0 | D65: 2 | E65: =D65/SUM(D11:D74) -> 9.0909090909090912E-2 | F65: 5 | G65: =F65/SUM(F11:F74) -> 3.4965034965034968E-2 | I65: =H65/SUM(H11:H74) -> 0 | K65: =J65/SUM(J11:J74) -> 0 | L65: 3 | M65: =L65/SUM(L11:L74) -> 2.1428571428571429E-2 | N65: 2 | O65: =N65/SUM(N11:N74) -> 9.9009900990099011E-3 | Q65: =P65/SUM(P11:P74) -> 0
A66: That's What You Always Say | C66: =B66/SUM(B11:B74) -> 0 | E66: =D66/SUM(D11:D74) -> 0 | G66: =F66/SUM(F11:F74) -> 0 | I66: =H66/SUM(H11:H74) -> 0 | K66: =J66/SUM(J11:J74) -> 0 | L66: 3 | M66: =L66/SUM(L11:L74) -> 2.1428571428571429E-2 | N66: 2 | O66: =N66/SUM(N11:N74) -> 9.9009900990099011E-3 | Q66: =P66/SUM(P11:P74) -> 0
A67: The Slow Song | C67: =B67/SUM(B11:B74) -> 0 | E67: =D67/SUM(D11:D74) -> 0 | G67: =F67/SUM(F11:F74) -> 0 | I67: =H67/SUM(H11:H74) -> 0 | K67: =J67/SUM(J11:J74) -> 0 | M67: =L67/SUM(L11:L74) -> 0 | N67: 2 | O67: =N67/SUM(N11:N74) -> 9.9009900990099011E-3 | Q67: =P67/SUM(P11:P74) -> 0
A68: Hey Sister | C68: =B68/SUM(B11:B74) -> 0 | E68: =D68/SUM(D11:D74) -> 0 | F68: 2 | G68: =F68/SUM(F11:F74) -> 1.3986013986013986E-2 | I68: =H68/SUM(H11:H74) -> 0 | J68: 5 | K68: =J68/SUM(J11:J74) -> 3.0674846625766871E-2 | L68: 4 | M68: =L68/SUM(L11:L74) -> 2.8571428571428571E-2 | N68: 1 | O68: =N68/SUM(N11:N74) -> 4.9504950495049506E-3 | Q68: =P68/SUM(P11:P74) -> 0
A69: I Can't Wait | C69: =B69/SUM(B11:B74) -> 0 | E69: =D69/SUM(D11:D74) -> 0 | F69: 2 | G69: =F69/SUM(F11:F74) -> 1.3986013986013986E-2 | I69: =H69/SUM(H11:H74) -> 0 | K69: =J69/SUM(J11:J74) -> 0 | L69: 3 | M69: =L69/SUM(L11:L74) -> 2.1428571428571429E-2 | N69: 1 | O69: =N69/SUM(N11:N74) -> 4.9504950495049506E-3 | Q69: =P69/SUM(P11:P74) -> 0
A70: La Popee Qui Faut Non | C70: =B70/SUM(B11:B74) -> 0 | E70: =D70/SUM(D11:D74) -> 0 | G70: =F70/SUM(F11:F74) -> 0 | I70: =H70/SUM(H11:H74) -> 0 | K70: =J70/SUM(J11:J74) -> 0 | M70: =L70/SUM(L11:L74) -> 0 | N70: 1 | O70: =N70/SUM(N11:N74) -> 4.9504950495049506E-3 | Q70: =P70/SUM(P11:P74) -> 0
A71: Season of the Witch | C71: =B71/SUM(B11:B74) -> 0 | E71: =D71/SUM(D11:D74) -> 0 | G71: =F71/SUM(F11:F74) -> 0 | I71: =H71/SUM(H11:H74) -> 0 | J71: 3 | K71: =J71/SUM(J11:J74) -> 1.8404907975460124E-2 | M71: =L71/SUM(L11:L74) -> 0 | N71: 1 | O71: =N71/SUM(N11:N74) -> 4.9504950495049506E-3 | Q71: =P71/SUM(P11:P74) -> 0
A72: Goodbye | C72: =B72/SUM(B11:B74) -> 0 | E72: =D72/SUM(D11:D74) -> 0 | F72: 2 | G72: =F72/SUM(F11:F74) -> 1.3986013986013986E-2 | I72: =H72/SUM(H11:H74) -> 0 | K72: =J72/SUM(J11:J74) -> 0 | M72: =L72/SUM(L11:L74) -> 0 | O72: =N72/SUM(N11:N74) -> 0 | Q72: =P72/SUM(P11:P74) -> 0
A73: Sleeping Pill | C73: =B73/SUM(B11:B74) -> 0 | E73: =D73/SUM(D11:D74) -> 0 | F73: 4 | G73: =F73/SUM(F11:F74) -> 2.7972027972027972E-2 | I73: =H73/SUM(H11:H74) -> 0 | K73: =J73/SUM(J11:J74) -> 0 | M73: =L73/SUM(L11:L74) -> 0 | O73: =N73/SUM(N11:N74) -> 0 | Q73: =P73/SUM(P11:P74) -> 0
A74: Smile | C74: =B74/SUM(B11:B74) -> 0 | E74: =D74/SUM(D11:D74) -> 0 | F74: 2 | G74: =F74/SUM(F11:F74) -> 1.3986013986013986E-2 | I74: =H74/SUM(H11:H74) -> 0 | K74: =J74/SUM(J11:J74) -> 0 | M74: =L74/SUM(L11:L74) -> 0 | O74: =N74/SUM(N11:N74) -> 0 | Q74: =P74/SUM(P11:P74) -> 0