A1: Galaxie 500 Mailing List // Survey Results // 1995 - 2002
A2: Survey | B2: 35034 | D2: 35217 | F2: 35400 | H2: 35582 | J2: 35947 | L2: 36312 | N2: 36708 | P2: 37591
A3: Main | B3: 88 | C3: =B3/SUM(B3:B4) -> 0.70967741935483875 | D3: 62 | E3: =D3/SUM(D3:D4) -> 0.57407407407407407 | F3: 137 | G3: =F3/SUM(F3:F4) -> 0.58297872340425527 | H3: 185 | I3: =H3/SUM(H3:H4) -> 0.54252199413489732 | J3: 207 | K3: =J3/SUM(J3:J4) -> 0.53350515463917525 | L3: 188 | M3: =L3/SUM(L3:L4) -> 0.49867374005305037 | N3: 170 | O3: =N3/SUM(N3:N4) -> 0.47887323943661969 | P3: 171 | Q3: =P3/SUM(P3:P4) -> 0.50442477876106195
A4: Digest | B4: 36 | C4: =B4/SUM(B3:B4) -> 0.29032258064516131 | D4: 46 | E4: =D4/SUM(D3:D4) -> 0.42592592592592593 | F4: 98 | G4: =F4/SUM(F3:F4) -> 0.41702127659574467 | H4: 156 | I4: =H4/SUM(H3:H4) -> 0.45747800586510262 | J4: 181 | K4: =J4/SUM(J3:J4) -> 0.46649484536082475 | L4: 189 | M4: =L4/SUM(L3:L4) -> 0.50132625994694957 | N4: 185 | O4: =N4/SUM(N3:N4) -> 0.52112676056338025 | P4: 168 | Q4: =P4/SUM(P3:P4) -> 0.49557522123893805
A5: Total | B5: =SUM(B3:B4) -> 124 | D5: =SUM(D3:D4) -> 108 | F5: =SUM(F3:F4) -> 235 | H5: =SUM(H3:H4) -> 341 | J5: =SUM(J3:J4) -> 388 | L5: =SUM(L3:L4) -> 377 | N5: =SUM(N3:N4) -> 355 | P5: =SUM(P3:P4) -> 339
A7: Responses | B7: 49 | C7: =B7/B5 -> 0.39516129032258063 | D7: 37 | E7: =D7/D5 -> 0.34259259259259262 | F7: 62 | G7: =F7/F5 -> 0.26382978723404255 | H7: 65 | I7: =H7/H5 -> 0.1906158357771261 | J7: 74 | K7: =J7/J5 -> 0.19072164948453607 | L7: 62 | M7: =L7/L5 -> 0.16445623342175067 | N7: 66 | O7: =N7/N5 -> 0.18591549295774648 | P7: 84 | Q7: =P7/P5 -> 0.24778761061946902
A9: Age | B9: 35034 | D9: 35217 | F9: 35400 | H9: 35582 | J9: 35947 | L9: 36312 | N9: 36708 | P9: 37591
A10: 15-19 | B10: 4 | C10: =B10/SUM(B10:B16) -> 8.1632653061224483E-2 | D10: 6 | E10: =D10/SUM(D10:D16) -> 0.16216216216216217 | F10: 9 | G10: =F10/SUM(F10:F16) -> 0.14516129032258066 | H10: 4 | I10: =H10/SUM(H10:H16) -> 6.1538461538461542E-2 | J10: 3 | K10: =J10/SUM(J10:J16) -> 4.1666666666666664E-2 | L10: 2 | M10: =L10/SUM(L10:L16) -> 3.2258064516129031E-2 | O10: =N10/SUM(N10:N16) -> 0 | P10: 1 | Q10: =P10/SUM(P10:P16) -> 1.2048192771084338E-2
A11: 20-24 | B11: 29 | C11: =B11/SUM(B10:B16) -> 0.59183673469387754 | D11: 16 | E11: =D11/SUM(D10:D16) -> 0.43243243243243246 | F11: 30 | G11: =F11/SUM(F10:F16) -> 0.4838709677419355 | H11: 22 | I11: =H11/SUM(H10:H16) -> 0.33846153846153848 | J11: 27 | K11: =J11/SUM(J10:J16) -> 0.375 | L11: 16 | M11: =L11/SUM(L10:L16) -> 0.25806451612903225 | N11: 9 | O11: =N11/SUM(N10:N16) -> 0.13432835820895522 | P11: 3 | Q11: =P11/SUM(P10:P16) -> 3.614457831325301E-2
A12: 25-29 | B12: 13 | C12: =B12/SUM(B10:B16) -> 0.26530612244897961 | D12: 11 | E12: =D12/SUM(D10:D16) -> 0.29729729729729731 | F12: 18 | G12: =F12/SUM(F10:F16) -> 0.29032258064516131 | H12: 29 | I12: =H12/SUM(H10:H16) -> 0.44615384615384618 | J12: 24 | K12: =J12/SUM(J10:J16) -> 0.33333333333333331 | L12: 23 | M12: =L12/SUM(L10:L16) -> 0.37096774193548387 | N12: 28 | O12: =N12/SUM(N10:N16) -> 0.41791044776119401 | P12: 28 | Q12: =P12/SUM(P10:P16) -> 0.33734939759036142
A13: 30-34 | B13: 2 | C13: =B13/SUM(B10:B16) -> 4.0816326530612242E-2 | D13: 2 | E13: =D13/SUM(D10:D16) -> 5.4054054054054057E-2 | F13: 3 | G13: =F13/SUM(F10:F16) -> 4.8387096774193547E-2 | H13: 8 | I13: =H13/SUM(H10:H16) -> 0.12307692307692308 | J13: 12 | K13: =J13/SUM(J10:J16) -> 0.16666666666666666 | L13: 14 | M13: =L13/SUM(L10:L16) -> 0.22580645161290322 | N13: 20 | O13: =N13/SUM(N10:N16) -> 0.29850746268656714 | P13: 27 | Q13: =P13/SUM(P10:P16) -> 0.3253012048192771
A14: 35-39 | C14: =B14/SUM(B10:B16) -> 0 | D14: 1 | E14: =D14/SUM(D10:D16) -> 2.7027027027027029E-2 | G14: =F14/SUM(F10:F16) -> 0 | H14: 1 | I14: =H14/SUM(H10:H16) -> 1.5384615384615385E-2 | J14: 2 | K14: =J14/SUM(J10:J16) -> 2.7777777777777776E-2 | L14: 4 | M14: =L14/SUM(L10:L16) -> 6.4516129032258063E-2 | N14: 7 | O14: =N14/SUM(N10:N16) -> 0.1044776119402985 | P14: 17 | Q14: =P14/SUM(P10:P16) -> 0.20481927710843373
A15: 40-49 | B15: 1 | C15: =B15/SUM(B10:B16) -> 2.0408163265306121E-2 | D15: 1 | E15: =D15/SUM(D10:D16) -> 2.7027027027027029E-2 | F15: 2 | G15: =F15/SUM(F10:F16) -> 3.2258064516129031E-2 | H15: 1 | I15: =H15/SUM(H10:H16) -> 1.5384615384615385E-2 | J15: 4 | K15: =J15/SUM(J10:J16) -> 5.5555555555555552E-2 | L15: 2 | M15: =L15/SUM(L10:L16) -> 3.2258064516129031E-2 | N15: 2 | O15: =N15/SUM(N10:N16) -> 2.9850746268656716E-2 | P15: 5 | Q15: =P15/SUM(P10:P16) -> 6.0240963855421686E-2
A16: 50+ | C16: =B16/SUM(B10:B16) -> 0 | E16: =D16/SUM(D10:D16) -> 0 | G16: =F16/SUM(F10:F16) -> 0 | I16: =H16/SUM(H10:H16) -> 0 | K16: =J16/SUM(J10:J16) -> 0 | L16: 1 | M16: =L16/SUM(L10:L16) -> 1.6129032258064516E-2 | N16: 1 | O16: =N16/SUM(N10:N16) -> 1.4925373134328358E-2 | P16: 2 | Q16: =P16/SUM(P10:P16) -> 2.4096385542168676E-2
A18: Sex | B18: 35034 | D18: 35217 | F18: 35400 | H18: 35582 | J18: 35947 | L18: 36312 | N18: 36708 | P18: 37591
A19: Male | B19: 43 | C19: =B19/SUM(B19:B20) -> 0.84313725490196079 | D19: 29 | E19: =D19/SUM(D19:D20) -> 0.78378378378378377 | F19: 53 | G19: =F19/SUM(F19:F20) -> 0.85483870967741937 | H19: 57 | I19: =H19/SUM(H19:H20) -> 0.87692307692307692 | J19: 63 | K19: =J19/SUM(J19:J20) -> 0.86301369863013699 | L19: 55 | M19: =L19/SUM(L19:L20) -> 0.88709677419354838 | N19: 57 | O19: =N19/SUM(N19:N20) -> 0.85074626865671643 | P19: 73 | Q19: =P19/SUM(P19:P20) -> 0.91249999999999998
A20: Female | B20: 8 | C20: =B20/SUM(B19:B20) -> 0.15686274509803921 | D20: 8 | E20: =D20/SUM(D19:D20) -> 0.21621621621621623 | F20: 9 | G20: =F20/SUM(F19:F20) -> 0.14516129032258066 | H20: 8 | I20: =H20/SUM(H19:H20) -> 0.12307692307692308 | J20: 10 | K20: =J20/SUM(J19:J20) -> 0.13698630136986301 | L20: 7 | M20: =L20/SUM(L19:L20) -> 0.11290322580645161 | N20: 10 | O20: =N20/SUM(N19:N20) -> 0.14925373134328357 | P20: 7 | Q20: =P20/SUM(P19:P20) -> 8.7499999999999994E-2
A22: Country | B22: 35034 | D22: 35217 | F22: 35400 | H22: 35582 | J22: 35947 | L22: 36312 | N22: 36708 | P22: 37591
A23: USA | B23: 36 | C23: =B23/SUM(B23:B42) -> 0.76595744680851063 | D23: 26 | E23: =D23/SUM(D23:D42) -> 0.72222222222222221 | F23: 46 | G23: =F23/SUM(F23:F42) -> 0.74193548387096775 | H23: 42 | I23: =H23/SUM(H23:H42) -> 0.67741935483870963 | J23: 54 | K23: =J23/SUM(J23:J42) -> 0.73972602739726023 | L23: 38 | M23: =L23/SUM(L23:L42) -> 0.61290322580645162 | N23: 47 | O23: =N23/SUM(N23:N42) -> 0.70149253731343286 | P23: 60 | Q23: =P23/SUM(P23:P42) -> 0.72289156626506024
A24: UK | B24: 6 | C24: =B24/SUM(B23:B42) -> 0.1276595744680851 | D24: 4 | E24: =D24/SUM(D23:D42) -> 0.1111111111111111 | F24: 8 | G24: =F24/SUM(F23:F42) -> 0.12903225806451613 | H24: 6 | I24: =H24/SUM(H23:H42) -> 9.6774193548387094E-2 | J24: 6 | K24: =J24/SUM(J23:J42) -> 8.2191780821917804E-2 | L24: 5 | M24: =L24/SUM(L23:L42) -> 8.0645161290322578E-2 | N24: 6 | O24: =N24/SUM(N23:N42) -> 8.9552238805970144E-2 | P24: 8 | Q24: =P24/SUM(P23:P42) -> 9.6385542168674704E-2
A25: Canada | B25: 4 | C25: =B25/SUM(B23:B42) -> 8.5106382978723402E-2 | D25: 3 | E25: =D25/SUM(D23:D42) -> 8.3333333333333329E-2 | F25: 6 | G25: =F25/SUM(F23:F42) -> 9.6774193548387094E-2 | H25: 6 | I25: =H25/SUM(H23:H42) -> 9.6774193548387094E-2 | J25: 3 | K25: =J25/SUM(J23:J42) -> 4.1095890410958902E-2 | L25: 4 | M25: =L25/SUM(L23:L42) -> 6.4516129032258063E-2 | O25: =N25/SUM(N23:N42) -> 0 | P25: 3 | Q25: =P25/SUM(P23:P42) -> 3.614457831325301E-2
A26: Denmark | C26: =B26/SUM(B23:B42) -> 0 | E26: =D26/SUM(D23:D42) -> 0 | G26: =F26/SUM(F23:F42) -> 0 | I26: =H26/SUM(H23:H42) -> 0 | K26: =J26/SUM(J23:J42) -> 0 | L26: 1 | M26: =L26/SUM(L23:L42) -> 1.6129032258064516E-2 | N26: 1 | O26: =N26/SUM(N23:N42) -> 1.4925373134328358E-2 | P26: 2 | Q26: =P26/SUM(P23:P42) -> 2.4096385542168676E-2
A27: Spain | C27: =B27/SUM(B23:B42) -> 0 | E27: =D27/SUM(D23:D42) -> 0 | G27: =F27/SUM(F23:F42) -> 0 | I27: =H27/SUM(H23:H42) -> 0 | J27: 2 | K27: =J27/SUM(J23:J42) -> 2.7397260273972601E-2 | L27: 1 | M27: =L27/SUM(L23:L42) -> 1.6129032258064516E-2 | N27: 2 | O27: =N27/SUM(N23:N42) -> 2.9850746268656716E-2 | P27: 2 | Q27: =P27/SUM(P23:P42) -> 2.4096385542168676E-2
A28: Germany | C28: =B28/SUM(B23:B42) -> 0 | E28: =D28/SUM(D23:D42) -> 0 | G28: =F28/SUM(F23:F42) -> 0 | I28: =H28/SUM(H23:H42) -> 0 | J28: 1 | K28: =J28/SUM(J23:J42) -> 1.3698630136986301E-2 | L28: 3 | M28: =L28/SUM(L23:L42) -> 4.8387096774193547E-2 | N28: 2 | O28: =N28/SUM(N23:N42) -> 2.9850746268656716E-2 | P28: 1 | Q28: =P28/SUM(P23:P42) -> 1.2048192771084338E-2
A29: Japan | C29: =B29/SUM(B23:B42) -> 0 | E29: =D29/SUM(D23:D42) -> 0 | G29: =F29/SUM(F23:F42) -> 0 | H29: 4 | I29: =H29/SUM(H23:H42) -> 6.4516129032258063E-2 | J29: 2 | K29: =J29/SUM(J23:J42) -> 2.7397260273972601E-2 | L29: 3 | M29: =L29/SUM(L23:L42) -> 4.8387096774193547E-2 | N29: 2 | O29: =N29/SUM(N23:N42) -> 2.9850746268656716E-2 | P29: 1 | Q29: =P29/SUM(P23:P42) -> 1.2048192771084338E-2
A30: France | B30: 1 | C30: =B30/SUM(B23:B42) -> 2.1276595744680851E-2 | D30: 2 | E30: =D30/SUM(D23:D42) -> 5.5555555555555552E-2 | G30: =F30/SUM(F23:F42) -> 0 | I30: =H30/SUM(H23:H42) -> 0 | J30: 1 | K30: =J30/SUM(J23:J42) -> 1.3698630136986301E-2 | L30: 1 | M30: =L30/SUM(L23:L42) -> 1.6129032258064516E-2 | N30: 1 | O30: =N30/SUM(N23:N42) -> 1.4925373134328358E-2 | P30: 1 | Q30: =P30/SUM(P23:P42) -> 1.2048192771084338E-2
A31: Holland | C31: =B31/SUM(B23:B42) -> 0 | E31: =D31/SUM(D23:D42) -> 0 | G31: =F31/SUM(F23:F42) -> 0 | I31: =H31/SUM(H23:H42) -> 0 | K31: =J31/SUM(J23:J42) -> 0 | L31: 1 | M31: =L31/SUM(L23:L42) -> 1.6129032258064516E-2 | N31: 1 | O31: =N31/SUM(N23:N42) -> 1.4925373134328358E-2 | P31: 1 | Q31: =P31/SUM(P23:P42) -> 1.2048192771084338E-2
A32: New Zealand | C32: =B32/SUM(B23:B42) -> 0 | E32: =D32/SUM(D23:D42) -> 0 | G32: =F32/SUM(F23:F42) -> 0 | H32: 2 | I32: =H32/SUM(H23:H42) -> 3.2258064516129031E-2 | J32: 1 | K32: =J32/SUM(J23:J42) -> 1.3698630136986301E-2 | M32: =L32/SUM(L23:L42) -> 0 | O32: =N32/SUM(N23:N42) -> 0 | P32: 1 | Q32: =P32/SUM(P23:P42) -> 1.2048192771084338E-2
A33: Cambodia | C33: =B33/SUM(B23:B42) -> 0 | E33: =D33/SUM(D23:D42) -> 0 | G33: =F33/SUM(F23:F42) -> 0 | I33: =H33/SUM(H23:H42) -> 0 | K33: =J33/SUM(J23:J42) -> 0 | M33: =L33/SUM(L23:L42) -> 0 | O33: =N33/SUM(N23:N42) -> 0 | P33: 1 | Q33: =P33/SUM(P23:P42) -> 1.2048192771084338E-2
A34: Lebanon | C34: =B34/SUM(B23:B42) -> 0 | E34: =D34/SUM(D23:D42) -> 0 | G34: =F34/SUM(F23:F42) -> 0 | I34: =H34/SUM(H23:H42) -> 0 | K34: =J34/SUM(J23:J42) -> 0 | M34: =L34/SUM(L23:L42) -> 0 | O34: =N34/SUM(N23:N42) -> 0 | P34: 1 | Q34: =P34/SUM(P23:P42) -> 1.2048192771084338E-2
A35: Norway | C35: =B35/SUM(B23:B42) -> 0 | E35: =D35/SUM(D23:D42) -> 0 | G35: =F35/SUM(F23:F42) -> 0 | I35: =H35/SUM(H23:H42) -> 0 | K35: =J35/SUM(J23:J42) -> 0 | M35: =L35/SUM(L23:L42) -> 0 | N35: 1 | O35: =N35/SUM(N23:N42) -> 1.4925373134328358E-2 | P35: 1 | Q35: =P35/SUM(P23:P42) -> 1.2048192771084338E-2
A36: Australia | C36: =B36/SUM(B23:B42) -> 0 | E36: =D36/SUM(D23:D42) -> 0 | G36: =F36/SUM(F23:F42) -> 0 | I36: =H36/SUM(H23:H42) -> 0 | J36: 1 | K36: =J36/SUM(J23:J42) -> 1.3698630136986301E-2 | L36: 1 | M36: =L36/SUM(L23:L42) -> 1.6129032258064516E-2 | O36: =N36/SUM(N23:N42) -> 0 | Q36: =P36/SUM(P23:P42) -> 0
A37: Brazil | C37: =B37/SUM(B23:B42) -> 0 | E37: =D37/SUM(D23:D42) -> 0 | F37: 1 | G37: =F37/SUM(F23:F42) -> 1.6129032258064516E-2 | I37: =H37/SUM(H23:H42) -> 0 | K37: =J37/SUM(J23:J42) -> 0 | L37: 1 | M37: =L37/SUM(L23:L42) -> 1.6129032258064516E-2 | N37: 2 | O37: =N37/SUM(N23:N42) -> 2.9850746268656716E-2 | Q37: =P37/SUM(P23:P42) -> 0
A38: Estonia | C38: =B38/SUM(B23:B42) -> 0 | E38: =D38/SUM(D23:D42) -> 0 | G38: =F38/SUM(F23:F42) -> 0 | I38: =H38/SUM(H23:H42) -> 0 | K38: =J38/SUM(J23:J42) -> 0 | L38: 1 | M38: =L38/SUM(L23:L42) -> 1.6129032258064516E-2 | O38: =N38/SUM(N23:N42) -> 0 | Q38: =P38/SUM(P23:P42) -> 0
A39: Ireland | C39: =B39/SUM(B23:B42) -> 0 | D39: 1 | E39: =D39/SUM(D23:D42) -> 2.7777777777777776E-2 | F39: 1 | G39: =F39/SUM(F23:F42) -> 1.6129032258064516E-2 | H39: 2 | I39: =H39/SUM(H23:H42) -> 3.2258064516129031E-2 | J39: 1 | K39: =J39/SUM(J23:J42) -> 1.3698630136986301E-2 | L39: 1 | M39: =L39/SUM(L23:L42) -> 1.6129032258064516E-2 | O39: =N39/SUM(N23:N42) -> 0 | Q39: =P39/SUM(P23:P42) -> 0
A40: Taiwan | C40: =B40/SUM(B23:B42) -> 0 | E40: =D40/SUM(D23:D42) -> 0 | G40: =F40/SUM(F23:F42) -> 0 | I40: =H40/SUM(H23:H42) -> 0 | J40: 1 | K40: =J40/SUM(J23:J42) -> 1.3698630136986301E-2 | L40: 1 | M40: =L40/SUM(L23:L42) -> 1.6129032258064516E-2 | O40: =N40/SUM(N23:N42) -> 0 | Q40: =P40/SUM(P23:P42) -> 0
A41: Sweden | C41: =B41/SUM(B23:B42) -> 0 | E41: =D41/SUM(D23:D42) -> 0 | G41: =F41/SUM(F23:F42) -> 0 | I41: =H41/SUM(H23:H42) -> 0 | K41: =J41/SUM(J23:J42) -> 0 | M41: =L41/SUM(L23:L42) -> 0 | N41: 1 | O41: =N41/SUM(N23:N42) -> 1.4925373134328358E-2 | Q41: =P41/SUM(P23:P42) -> 0
A42: South Africa | C42: =B42/SUM(B23:B42) -> 0 | E42: =D42/SUM(D23:D42) -> 0 | G42: =F42/SUM(F23:F42) -> 0 | I42: =H42/SUM(H23:H42) -> 0 | K42: =J42/SUM(J23:J42) -> 0 | M42: =L42/SUM(L23:L42) -> 0 | N42: 1 | O42: =N42/SUM(N23:N42) -> 1.4925373134328358E-2 | Q42: =P42/SUM(P23:P42) -> 0