A1: Galaxie 500 Mailing List // Survey Results // 1995 - 2002
A2: Galaxie 500 album | B2: 35034 | D2: 35217 | F2: 35400 | H2: 35582 | J2: 35947 | L2: 36312 | N2: 36708 | P2: 37591
A3: Today | B3: 18 | C3: =B3/SUM(B3:B5) -> 0.4 | D3: 14 | E3: =D3/SUM(D3:D5) -> 0.4375 | F3: 19 | G3: =F3/SUM(F3:F5) -> 0.31666666666666665 | H3: 21 | I3: =H3/SUM(H3:H5) -> 0.32307692307692309 | J3: 22 | K3: =J3/SUM(J3:J5) -> 0.31428571428571428 | L3: 20 | M3: =L3/SUM(L3:L5) -> 0.33898305084745761 | N3: 15 | O3: =N3/SUM(N3:N5) -> 0.24193548387096775 | P3: 17 | Q3: =P3/SUM(P3:P5) -> 0.22666666666666666
A4: On Fire | B4: 21 | C4: =B4/SUM(B3:B5) -> 0.46666666666666667 | D4: 12 | E4: =D4/SUM(D3:D5) -> 0.375 | F4: 29 | G4: =F4/SUM(F3:F5) -> 0.48333333333333334 | H4: 34 | I4: =H4/SUM(H3:H5) -> 0.52307692307692311 | J4: 34 | K4: =J4/SUM(J3:J5) -> 0.48571428571428571 | L4: 27 | M4: =L4/SUM(L3:L5) -> 0.4576271186440678 | N4: 36 | O4: =N4/SUM(N3:N5) -> 0.58064516129032262 | P4: 40 | Q4: =P4/SUM(P3:P5) -> 0.53333333333333333
A5: This Is Our Music | B5: 6 | C5: =B5/SUM(B3:B5) -> 0.13333333333333333 | D5: 6 | E5: =D5/SUM(D3:D5) -> 0.1875 | F5: 12 | G5: =F5/SUM(F3:F5) -> 0.2 | H5: 10 | I5: =H5/SUM(H3:H5) -> 0.15384615384615385 | J5: 14 | K5: =J5/SUM(J3:J5) -> 0.2 | L5: 12 | M5: =L5/SUM(L3:L5) -> 0.20338983050847459 | N5: 11 | O5: =N5/SUM(N3:N5) -> 0.17741935483870969 | P5: 18 | Q5: =P5/SUM(P3:P5) -> 0.24
A7: Galaxie 500 song | B7: 35034 | D7: 35217 | F7: 35400 | H7: 35582 | J7: 35947 | L7: 36312 | N7: 36708 | P7: 37591
A8: Fourth Of July | C8: =B8/SUM(B8:B43) -> 0 | E8: =D8/SUM(D8:D43) -> 0 | F8: 14 | G8: =F8/SUM(F8:F43) -> 9.1503267973856203E-2 | H8: 19 | I8: =H8/SUM(H8:H43) -> 0.13970588235294118 | J8: 26 | K8: =J8/SUM(J8:J43) -> 0.14525139664804471 | L8: 22 | M8: =L8/SUM(L8:L43) -> 0.14864864864864866 | N8: 27 | O8: =N8/SUM(N8:N43) -> 0.14917127071823205 | P8: 36 | Q8: =P8/SUM(P8:P43) -> 0.17224880382775121
A9: Tugboat | B9: 5 | C9: =B9/SUM(B8:B43) -> 0.19230769230769232 | D9: 2 | E9: =D9/SUM(D8:D43) -> 0.08 | F9: 19 | G9: =F9/SUM(F8:F43) -> 0.12418300653594772 | H9: 15 | I9: =H9/SUM(H8:H43) -> 0.11029411764705882 | J9: 31 | K9: =J9/SUM(J8:J43) -> 0.17318435754189945 | L9: 23 | M9: =L9/SUM(L8:L43) -> 0.1554054054054054 | N9: 15 | O9: =N9/SUM(N8:N43) -> 8.2872928176795577E-2 | P9: 26 | Q9: =P9/SUM(P8:P43) -> 0.12440191387559808
A10: Blue Thunder | B10: 5 | C10: =B10/SUM(B8:B43) -> 0.19230769230769232 | D10: 4 | E10: =D10/SUM(D8:D43) -> 0.16 | F10: 13 | G10: =F10/SUM(F8:F43) -> 8.4967320261437912E-2 | H10: 20 | I10: =H10/SUM(H8:H43) -> 0.14705882352941177 | J10: 13 | K10: =J10/SUM(J8:J43) -> 7.2625698324022353E-2 | L10: 13 | M10: =L10/SUM(L8:L43) -> 8.7837837837837843E-2 | N10: 26 | O10: =N10/SUM(N8:N43) -> 0.143646408839779 | P10: 18 | Q10: =P10/SUM(P8:P43) -> 8.6124401913875603E-2
A11: When Will You Come Home | C11: =B11/SUM(B8:B43) -> 0 | E11: =D11/SUM(D8:D43) -> 0 | F11: 7 | G11: =F11/SUM(F8:F43) -> 4.5751633986928102E-2 | H11: 12 | I11: =H11/SUM(H8:H43) -> 8.8235294117647065E-2 | J11: 14 | K11: =J11/SUM(J8:J43) -> 7.8212290502793297E-2 | L11: 10 | M11: =L11/SUM(L8:L43) -> 6.7567567567567571E-2 | N11: 9 | O11: =N11/SUM(N8:N43) -> 4.9723756906077346E-2 | P11: 16 | Q11: =P11/SUM(P8:P43) -> 7.6555023923444973E-2
A12: Snowstorm | B12: 2 | C12: =B12/SUM(B8:B43) -> 7.6923076923076927E-2 | D12: 5 | E12: =D12/SUM(D8:D43) -> 0.2 | F12: 9 | G12: =F12/SUM(F8:F43) -> 5.8823529411764705E-2 | H12: 10 | I12: =H12/SUM(H8:H43) -> 7.3529411764705885E-2 | J12: 8 | K12: =J12/SUM(J8:J43) -> 4.4692737430167599E-2 | L12: 6 | M12: =L12/SUM(L8:L43) -> 4.0540540540540543E-2 | N12: 9 | O12: =N12/SUM(N8:N43) -> 4.9723756906077346E-2 | P12: 13 | Q12: =P12/SUM(P8:P43) -> 6.2200956937799042E-2
A13: Listen, The Snow Is Falling | C13: =B13/SUM(B8:B43) -> 0 | E13: =D13/SUM(D8:D43) -> 0 | F13: 7 | G13: =F13/SUM(F8:F43) -> 4.5751633986928102E-2 | I13: =H13/SUM(H8:H43) -> 0 | J13: 10 | K13: =J13/SUM(J8:J43) -> 5.5865921787709494E-2 | L13: 8 | M13: =L13/SUM(L8:L43) -> 5.4054054054054057E-2 | N13: 4 | O13: =N13/SUM(N8:N43) -> 2.2099447513812154E-2 | P13: 11 | Q13: =P13/SUM(P8:P43) -> 5.2631578947368418E-2
A14: Strange | B14: 5 | C14: =B14/SUM(B8:B43) -> 0.19230769230769232 | D14: 2 | E14: =D14/SUM(D8:D43) -> 0.08 | F14: 15 | G14: =F14/SUM(F8:F43) -> 9.8039215686274508E-2 | H14: 12 | I14: =H14/SUM(H8:H43) -> 8.8235294117647065E-2 | J14: 7 | K14: =J14/SUM(J8:J43) -> 3.9106145251396648E-2 | L14: 14 | M14: =L14/SUM(L8:L43) -> 9.45945945945946E-2 | N14: 14 | O14: =N14/SUM(N8:N43) -> 7.7348066298342538E-2 | P14: 10 | Q14: =P14/SUM(P8:P43) -> 4.784688995215311E-2
A15: Temperature's Rising | C15: =B15/SUM(B8:B43) -> 0 | E15: =D15/SUM(D8:D43) -> 0 | F15: 2 | G15: =F15/SUM(F8:F43) -> 1.3071895424836602E-2 | I15: =H15/SUM(H8:H43) -> 0 | J15: 4 | K15: =J15/SUM(J8:J43) -> 2.23463687150838E-2 | L15: 6 | M15: =L15/SUM(L8:L43) -> 4.0540540540540543E-2 | N15: 6 | O15: =N15/SUM(N8:N43) -> 3.3149171270718231E-2 | P15: 8 | Q15: =P15/SUM(P8:P43) -> 3.8277511961722487E-2
A16: Ceremony | B16: 2 | C16: =B16/SUM(B8:B43) -> 7.6923076923076927E-2 | D16: 3 | E16: =D16/SUM(D8:D43) -> 0.12 | F16: 4 | G16: =F16/SUM(F8:F43) -> 2.6143790849673203E-2 | H16: 7 | I16: =H16/SUM(H8:H43) -> 5.1470588235294115E-2 | J16: 5 | K16: =J16/SUM(J8:J43) -> 2.7932960893854747E-2 | L16: 6 | M16: =L16/SUM(L8:L43) -> 4.0540540540540543E-2 | N16: 6 | O16: =N16/SUM(N8:N43) -> 3.3149171270718231E-2 | P16: 7 | Q16: =P16/SUM(P8:P43) -> 3.3492822966507178E-2
A17: Oblivious | B17: 4 | C17: =B17/SUM(B8:B43) -> 0.15384615384615385 | D17: 3 | E17: =D17/SUM(D8:D43) -> 0.12 | F17: 7 | G17: =F17/SUM(F8:F43) -> 4.5751633986928102E-2 | H17: 9 | I17: =H17/SUM(H8:H43) -> 6.6176470588235295E-2 | J17: 5 | K17: =J17/SUM(J8:J43) -> 2.7932960893854747E-2 | L17: 9 | M17: =L17/SUM(L8:L43) -> 6.0810810810810814E-2 | N17: 6 | O17: =N17/SUM(N8:N43) -> 3.3149171270718231E-2 | P17: 6 | Q17: =P17/SUM(P8:P43) -> 2.8708133971291867E-2
A18: Don't Let Our Youth Go to Waste | C18: =B18/SUM(B8:B43) -> 0 | E18: =D18/SUM(D8:D43) -> 0 | F18: 3 | G18: =F18/SUM(F8:F43) -> 1.9607843137254902E-2 | H18: 5 | I18: =H18/SUM(H8:H43) -> 3.6764705882352942E-2 | J18: 5 | K18: =J18/SUM(J8:J43) -> 2.7932960893854747E-2 | L18: 7 | M18: =L18/SUM(L8:L43) -> 4.72972972972973E-2 | N18: 5 | O18: =N18/SUM(N8:N43) -> 2.7624309392265192E-2 | P18: 6 | Q18: =P18/SUM(P8:P43) -> 2.8708133971291867E-2
A19: Decomposing Trees | C19: =B19/SUM(B8:B43) -> 0 | E19: =D19/SUM(D8:D43) -> 0 | F19: 3 | G19: =F19/SUM(F8:F43) -> 1.9607843137254902E-2 | I19: =H19/SUM(H8:H43) -> 0 | J19: 6 | K19: =J19/SUM(J8:J43) -> 3.3519553072625698E-2 | L19: 5 | M19: =L19/SUM(L8:L43) -> 3.3783783783783786E-2 | N19: 13 | O19: =N19/SUM(N8:N43) -> 7.18232044198895E-2 | P19: 6 | Q19: =P19/SUM(P8:P43) -> 2.8708133971291867E-2
A20: Melt Away | C20: =B20/SUM(B8:B43) -> 0 | E20: =D20/SUM(D8:D43) -> 0 | F20: 2 | G20: =F20/SUM(F8:F43) -> 1.3071895424836602E-2 | I20: =H20/SUM(H8:H43) -> 0 | J20: 4 | K20: =J20/SUM(J8:J43) -> 2.23463687150838E-2 | M20: =L20/SUM(L8:L43) -> 0 | N20: 5 | O20: =N20/SUM(N8:N43) -> 2.7624309392265192E-2 | P20: 5 | Q20: =P20/SUM(P8:P43) -> 2.3923444976076555E-2
A21: Pictures | C21: =B21/SUM(B8:B43) -> 0 | E21: =D21/SUM(D8:D43) -> 0 | F21: 4 | G21: =F21/SUM(F8:F43) -> 2.6143790849673203E-2 | I21: =H21/SUM(H8:H43) -> 0 | J21: 3 | K21: =J21/SUM(J8:J43) -> 1.6759776536312849E-2 | M21: =L21/SUM(L8:L43) -> 0 | N21: 2 | O21: =N21/SUM(N8:N43) -> 1.1049723756906077E-2 | P21: 4 | Q21: =P21/SUM(P8:P43) -> 1.9138755980861243E-2
A22: Sorry | C22: =B22/SUM(B8:B43) -> 0 | E22: =D22/SUM(D8:D43) -> 0 | F22: 2 | G22: =F22/SUM(F8:F43) -> 1.3071895424836602E-2 | H22: 5 | I22: =H22/SUM(H8:H43) -> 3.6764705882352942E-2 | J22: 6 | K22: =J22/SUM(J8:J43) -> 3.3519553072625698E-2 | L22: 3 | M22: =L22/SUM(L8:L43) -> 2.0270270270270271E-2 | N22: 2 | O22: =N22/SUM(N8:N43) -> 1.1049723756906077E-2 | P22: 4 | Q22: =P22/SUM(P8:P43) -> 1.9138755980861243E-2
A23: Tell Me | C23: =B23/SUM(B8:B43) -> 0 | E23: =D23/SUM(D8:D43) -> 0 | F23: 3 | G23: =F23/SUM(F8:F43) -> 1.9607843137254902E-2 | I23: =H23/SUM(H8:H43) -> 0 | J23: 4 | K23: =J23/SUM(J8:J43) -> 2.23463687150838E-2 | M23: =L23/SUM(L8:L43) -> 0 | N23: 1 | O23: =N23/SUM(N8:N43) -> 5.5248618784530384E-3 | P23: 4 | Q23: =P23/SUM(P8:P43) -> 1.9138755980861243E-2
A24: Instrumental | C24: =B24/SUM(B8:B43) -> 0 | D24: 2 | E24: =D24/SUM(D8:D43) -> 0.08 | F24: 2 | G24: =F24/SUM(F8:F43) -> 1.3071895424836602E-2 | I24: =H24/SUM(H8:H43) -> 0 | K24: =J24/SUM(J8:J43) -> 0 | M24: =L24/SUM(L8:L43) -> 0 | N24: 2 | O24: =N24/SUM(N8:N43) -> 1.1049723756906077E-2 | P24: 4 | Q24: =P24/SUM(P8:P43) -> 1.9138755980861243E-2
A25: King Of Spain | B25: 3 | C25: =B25/SUM(B8:B43) -> 0.11538461538461539 | D25: 2 | E25: =D25/SUM(D8:D43) -> 0.08 | F25: 5 | G25: =F25/SUM(F8:F43) -> 3.2679738562091505E-2 | H25: 6 | I25: =H25/SUM(H8:H43) -> 4.4117647058823532E-2 | J25: 8 | K25: =J25/SUM(J8:J43) -> 4.4692737430167599E-2 | L25: 3 | M25: =L25/SUM(L8:L43) -> 2.0270270270270271E-2 | N25: 5 | O25: =N25/SUM(N8:N43) -> 2.7624309392265192E-2 | P25: 3 | Q25: =P25/SUM(P8:P43) -> 1.4354066985645933E-2
A26: Hearing Voices | C26: =B26/SUM(B8:B43) -> 0 | E26: =D26/SUM(D8:D43) -> 0 | F26: 2 | G26: =F26/SUM(F8:F43) -> 1.3071895424836602E-2 | I26: =H26/SUM(H8:H43) -> 0 | K26: =J26/SUM(J8:J43) -> 0 | M26: =L26/SUM(L8:L43) -> 0 | N26: 4 | O26: =N26/SUM(N8:N43) -> 2.2099447513812154E-2 | P26: 3 | Q26: =P26/SUM(P8:P43) -> 1.4354066985645933E-2
A27: Parking Lot | C27: =B27/SUM(B8:B43) -> 0 | E27: =D27/SUM(D8:D43) -> 0 | F27: 3 | G27: =F27/SUM(F8:F43) -> 1.9607843137254902E-2 | I27: =H27/SUM(H8:H43) -> 0 | K27: =J27/SUM(J8:J43) -> 0 | L27: 6 | M27: =L27/SUM(L8:L43) -> 4.0540540540540543E-2 | N27: 3 | O27: =N27/SUM(N8:N43) -> 1.6574585635359115E-2 | P27: 3 | Q27: =P27/SUM(P8:P43) -> 1.4354066985645933E-2
A28: Summertime | C28: =B28/SUM(B8:B43) -> 0 | E28: =D28/SUM(D8:D43) -> 0 | F28: 6 | G28: =F28/SUM(F8:F43) -> 3.9215686274509803E-2 | H28: 10 | I28: =H28/SUM(H8:H43) -> 7.3529411764705885E-2 | J28: 8 | K28: =J28/SUM(J8:J43) -> 4.4692737430167599E-2 | L28: 4 | M28: =L28/SUM(L8:L43) -> 2.7027027027027029E-2 | N28: 3 | O28: =N28/SUM(N8:N43) -> 1.6574585635359115E-2 | P28: 3 | Q28: =P28/SUM(P8:P43) -> 1.4354066985645933E-2
A29: Flowers | C29: =B29/SUM(B8:B43) -> 0 | E29: =D29/SUM(D8:D43) -> 0 | G29: =F29/SUM(F8:F43) -> 0 | H29: 6 | I29: =H29/SUM(H8:H43) -> 4.4117647058823532E-2 | J29: 9 | K29: =J29/SUM(J8:J43) -> 5.027932960893855E-2 | L29: 3 | M29: =L29/SUM(L8:L43) -> 2.0270270270270271E-2 | N29: 5 | O29: =N29/SUM(N8:N43) -> 2.7624309392265192E-2 | P29: 2 | Q29: =P29/SUM(P8:P43) -> 9.5693779904306216E-3
A30: Walking Song | C30: =B30/SUM(B8:B43) -> 0 | E30: =D30/SUM(D8:D43) -> 0 | F30: 2 | G30: =F30/SUM(F8:F43) -> 1.3071895424836602E-2 | I30: =H30/SUM(H8:H43) -> 0 | K30: =J30/SUM(J8:J43) -> 0 | M30: =L30/SUM(L8:L43) -> 0 | N30: 2 | O30: =N30/SUM(N8:N43) -> 1.1049723756906077E-2 | P30: 2 | Q30: =P30/SUM(P8:P43) -> 9.5693779904306216E-3
A31: Isn't It A Pity | C31: =B31/SUM(B8:B43) -> 0 | E31: =D31/SUM(D8:D43) -> 0 | G31: =F31/SUM(F8:F43) -> 0 | I31: =H31/SUM(H8:H43) -> 0 | J31: 3 | K31: =J31/SUM(J8:J43) -> 1.6759776536312849E-2 | M31: =L31/SUM(L8:L43) -> 0 | N31: 1 | O31: =N31/SUM(N8:N43) -> 5.5248618784530384E-3 | P31: 2 | Q31: =P31/SUM(P8:P43) -> 9.5693779904306216E-3
A32: Crazy | C32: =B32/SUM(B8:B43) -> 0 | E32: =D32/SUM(D8:D43) -> 0 | G32: =F32/SUM(F8:F43) -> 0 | I32: =H32/SUM(H8:H43) -> 0 | K32: =J32/SUM(J8:J43) -> 0 | M32: =L32/SUM(L8:L43) -> 0 | N32: 2 | O32: =N32/SUM(N8:N43) -> 1.1049723756906077E-2 | P32: 1 | Q32: =P32/SUM(P8:P43) -> 4.7846889952153108E-3
A33: King Of Spain Part 2 | C33: =B33/SUM(B8:B43) -> 0 | E33: =D33/SUM(D8:D43) -> 0 | F33: 2 | G33: =F33/SUM(F8:F43) -> 1.3071895424836602E-2 | I33: =H33/SUM(H8:H43) -> 0 | K33: =J33/SUM(J8:J43) -> 0 | M33: =L33/SUM(L8:L43) -> 0 | N33: 2 | O33: =N33/SUM(N8:N43) -> 1.1049723756906077E-2 | P33: 1 | Q33: =P33/SUM(P8:P43) -> 4.7846889952153108E-3
A34: Moonshot | C34: =B34/SUM(B8:B43) -> 0 | E34: =D34/SUM(D8:D43) -> 0 | G34: =F34/SUM(F8:F43) -> 0 | I34: =H34/SUM(H8:H43) -> 0 | K34: =J34/SUM(J8:J43) -> 0 | M34: =L34/SUM(L8:L43) -> 0 | O34: =N34/SUM(N8:N43) -> 0 | P34: 1 | Q34: =P34/SUM(P8:P43) -> 4.7846889952153108E-3
A35: Here She Comes Now | C35: =B35/SUM(B8:B43) -> 0 | E35: =D35/SUM(D8:D43) -> 0 | G35: =F35/SUM(F8:F43) -> 0 | I35: =H35/SUM(H8:H43) -> 0 | K35: =J35/SUM(J8:J43) -> 0 | M35: =L35/SUM(L8:L43) -> 0 | O35: =N35/SUM(N8:N43) -> 0 | P35: 1 | Q35: =P35/SUM(P8:P43) -> 4.7846889952153108E-3
A36: Cheese and Onions | C36: =B36/SUM(B8:B43) -> 0 | E36: =D36/SUM(D8:D43) -> 0 | G36: =F36/SUM(F8:F43) -> 0 | I36: =H36/SUM(H8:H43) -> 0 | K36: =J36/SUM(J8:J43) -> 0 | M36: =L36/SUM(L8:L43) -> 0 | O36: =N36/SUM(N8:N43) -> 0 | P36: 1 | Q36: =P36/SUM(P8:P43) -> 4.7846889952153108E-3
A37: Plastic Bird | C37: =B37/SUM(B8:B43) -> 0 | E37: =D37/SUM(D8:D43) -> 0 | F37: 3 | G37: =F37/SUM(F8:F43) -> 1.9607843137254902E-2 | I37: =H37/SUM(H8:H43) -> 0 | K37: =J37/SUM(J8:J43) -> 0 | M37: =L37/SUM(L8:L43) -> 0 | O37: =N37/SUM(N8:N43) -> 0 | P37: 1 | Q37: =P37/SUM(P8:P43) -> 4.7846889952153108E-3
A38: The Other Side | C38: =B38/SUM(B8:B43) -> 0 | E38: =D38/SUM(D8:D43) -> 0 | F38: 4 | G38: =F38/SUM(F8:F43) -> 2.6143790849673203E-2 | I38: =H38/SUM(H8:H43) -> 0 | K38: =J38/SUM(J8:J43) -> 0 | M38: =L38/SUM(L8:L43) -> 0 | O38: =N38/SUM(N8:N43) -> 0 | P38: 1 | Q38: =P38/SUM(P8:P43) -> 4.7846889952153108E-3
A39: Another Day | C39: =B39/SUM(B8:B43) -> 0 | D39: 2 | E39: =D39/SUM(D8:D43) -> 0.08 | F39: 3 | G39: =F39/SUM(F8:F43) -> 1.9607843137254902E-2 | I39: =H39/SUM(H8:H43) -> 0 | K39: =J39/SUM(J8:J43) -> 0 | M39: =L39/SUM(L8:L43) -> 0 | N39: 1 | O39: =N39/SUM(N8:N43) -> 5.5248618784530384E-3 | Q39: =P39/SUM(P8:P43) -> 0
A40: Leave The Planet | C40: =B40/SUM(B8:B43) -> 0 | E40: =D40/SUM(D8:D43) -> 0 | G40: =F40/SUM(F8:F43) -> 0 | I40: =H40/SUM(H8:H43) -> 0 | K40: =J40/SUM(J8:J43) -> 0 | M40: =L40/SUM(L8:L43) -> 0 | N40: 1 | O40: =N40/SUM(N8:N43) -> 5.5248618784530384E-3 | Q40: =P40/SUM(P8:P43) -> 0
A41: It's Getting Late | C41: =B41/SUM(B8:B43) -> 0 | E41: =D41/SUM(D8:D43) -> 0 | F41: 2 | G41: =F41/SUM(F8:F43) -> 1.3071895424836602E-2 | I41: =H41/SUM(H8:H43) -> 0 | K41: =J41/SUM(J8:J43) -> 0 | M41: =L41/SUM(L8:L43) -> 0 | O41: =N41/SUM(N8:N43) -> 0 | Q41: =P41/SUM(P8:P43) -> 0
A42: Maracas Song | C42: =B42/SUM(B8:B43) -> 0 | E42: =D42/SUM(D8:D43) -> 0 | F42: 3 | G42: =F42/SUM(F8:F43) -> 1.9607843137254902E-2 | I42: =H42/SUM(H8:H43) -> 0 | K42: =J42/SUM(J8:J43) -> 0 | M42: =L42/SUM(L8:L43) -> 0 | O42: =N42/SUM(N8:N43) -> 0 | Q42: =P42/SUM(P8:P43) -> 0
A43: Rain | C43: =B43/SUM(B8:B43) -> 0 | E43: =D43/SUM(D8:D43) -> 0 | F43: 2 | G43: =F43/SUM(F8:F43) -> 1.3071895424836602E-2 | I43: =H43/SUM(H8:H43) -> 0 | K43: =J43/SUM(J8:J43) -> 0 | M43: =L43/SUM(L8:L43) -> 0 | O43: =N43/SUM(N8:N43) -> 0 | Q43: =P43/SUM(P8:P43) -> 0